,Unnamed: 0,Date,Rating,Review,Classification
32999,33000,2020-04-09 17:25:26,3,"O aplicativo é bom, só que devia ter lançamentos de filmes, como por exemplo: Wi-fi Ralph, Como Treinar o seu Dragão 3 e outros! Poxa... só coloca filmes deles mesmo se colocassem lançamentos de filme seria bom! Por favor, vejam meu comentário. Muitas pessoas concordariam comigo! Eu imploro a vocês 😢😢😢",Positiva
33017,33018,2020-04-09 17:05:21,3,Não estou conseguindo entrar no meu perfil ...a netflix fica inventando códigos que não deixa,Negativa
33040,33041,2020-04-09 16:41:05,3,"App bom, mas por favor melhorem a questao de travar a imagem e continuar o áudio, vcs não são tão ocupados a ponto de nao resolverem isso, o meu nao é o primeiro e não será o último comentário que diz isso, isso é um serviço pago, PELO MENOS FAÇAM ALGO QUE PRESTE.",Negativa
33058,33059,2020-04-09 16:11:38,3,Depois que atualizou não consigo mais abrir no celular.,Negativa
33074,33075,2020-04-09 15:54:18,3,"Boa tarde! Eu daria mais Estelas mais o aplicativo está com um probleminha. Quando estou assistindo a tela fica escuro na próxima cena e só ouço o áudio, sem vídeo. Podem dá uma olhadinha, por favor.",Negativa
33091,33092,2020-04-09 15:29:10,3,Pq que tiraram a cinderela o filme que fizeram gente eu amo aquele filme,Positiva
33121,33122,2020-04-09 14:28:33,3,"É bom, mas a qualidade dos vídeos deixam a desejar, meu celular tem a licença L1 e não passa em hd, já o prime Vídeo e o Globo Play passam em 1080P, ótima qualidade, já o DRM confirma que é L1 e no app da Netflix diz que é L3... vai entender.",Negativa
33131,33132,2020-04-09 14:12:44,3,Pra quem curte mais filmes q series é ruim. Muitos filmes velhis e nada a ver toma de 10x 0 pro telecine play no quesito acervo de filmes,Positiva
33168,33169,2020-04-09 13:03:23,3,Como faço pra cancelar o plano HD?,Negativa
33193,33194,2020-04-09 12:10:29,3,Porque vc não fazer mais Naruto ou Boruto 2 dias eu já vir tudo,Positiva
33198,33199,2020-04-09 12:00:14,3,Não está abrindo meu App no celular :( o meu celular é um Samsung j2,Negativa
33199,33200,2020-04-09 11:58:40,3,Bom di mais,Positiva
33214,33215,2020-04-09 11:12:45,3,"Netflix É um streaming maravilhoso, principalmente por fornecer as animações do Studio ghibli mas um erro grande é não ter todos os ep de Naruto Shippuden. Triste, chorei. Agradeço pela atenção.",Positiva
33229,33230,2020-04-09 10:29:50,3,Não tem muitos filmes clássicos e Demora muito pra trocar o catálogo de filmes lançamentos também.. tende atualizar melhor este aplicativo 👍,Positiva
33255,33256,2020-04-09 07:39:11,3,Atualmente Tem poucas series boas mas é o unico app de streaming realmente bom em interface download etc,Positiva
33257,33258,2020-04-09 07:24:31,3,Alret2020,Positiva
33258,33259,2020-04-09 07:05:19,3,"Outros aplicativos de streaming já suportam 1080p neste mesmo dispositivo, mas por algum motivo o app da Netflix não. O catálogo é excelente e a imagem na TV e no computador é maravilhosa, mas é muito desconfortável para quem está acostumado a consumir conteúdo em Full HD ter que se rebaixar aos 480p do aplicativo da Netflix para Android. Não estamos mais em 2012, praticamente todos os dispositivos existentes suportam 720p e/ou 1080p. É o que falta para a experiência ficar completa. ;)",Positiva
33264,33265,2020-04-09 06:22:12,3,Infelizmente não tem todos os filmes que a gente quer,Positiva
33288,33289,2020-04-09 04:57:50,3,"Has some good content here and there but most of it is low quality and relies on repetitive gimmicks. They already ruined some tv shows too just to juice some more money. Image quality at 1080p is pretty good but there are visible artifacts sometimes. Overall, not worth the price.",Positiva
33291,33292,2020-04-09 04:41:46,3,Melhor que pagar o Tele cine na Sky mas é caro,Positiva
33307,33308,2020-04-09 04:09:06,3,Os videos travam é horrível,Negativa
33330,33331,2020-04-09 03:44:17,3,"Falta series novas, filmes bons deveria ter como fazer comentários nos filmes e séries tipo YouTube mas não tem , e essa questão de ficar atualizando toda hora é muito chatoo",Positiva
33350,33351,2020-04-09 03:11:05,3,Olha o app é MT bom pra ver séries e filmes e tb é MT prático mas eu tô dando essa nota pq eles mentiram para os assinantes falando que a nova temporada ia sair em um dia mas até agora n saiu,Positiva
33354,33355,2020-04-09 03:07:44,3,Depois da ultima atualização não esta mais sendo possível adicionar nem remover filmes e séries da listas. Favor arrumar. :),Negativa
33379,33380,2020-04-09 02:32:40,3,"Pq vários filmes que tinham a opção do áudio em português não tem mais????? Poxaaaa q ódiooo, a tendência seria melhorar não é?!!! 🤔🤔",Negativa
33460,33461,2020-04-09 01:16:07,3,"Oi, eu tenho o aplicativo faz um bom tempo e eu não sei se foi a atualização ou o que, mas antes tinha a opção de tirar filmes/séries do ""continuar assistindo"" e eu conseguia tirar eles da ""minha lista"" tbm, agora não consigo mais, só fica acumulando, preferia como estava antes, se puderem deixar como estava antes (estava perfeito) eu agradeceria muito.",Negativa
33465,33466,2020-04-09 01:08:03,3,"Ah é muito bom, só devia ter mais filmes e séries, tem muitas que quase ninguém vê e as que queremos ver mesmo não tem",Positiva
33498,33499,2020-04-09 00:32:42,3,"Fica travando a imagem e continua com o áudio, não é a internet, e o app está atualizado.",Negativa
33528,33529,2020-04-09 00:09:43,3,O aplicativo é bom tem filmes e séries de boas.Mas não tem a opção de remover filme e séries da aba.,Positiva
33553,33554,2020-04-08 23:05:44,3,Não consigo remover os itens da minha lista.,Negativa
33555,33556,2020-04-08 23:03:37,3,Muito bom. Boas opções.,Positiva
33557,33558,2020-04-08 22:59:35,3,"Nunca tinha dado erro, agora a tela trava e a imagem fica congelada, pensei que fosse meu celular mas pelo visto nao é, e tambem nao estou conseguindo colocar filmes na minha lista . Espero que resolvam o problema.",Negativa
33559,33560,2020-04-08 22:55:14,3,Darei 5 estrelas se colocarem a serie naruto shippuden completaaaa!😕,Positiva
33561,33562,2020-04-08 22:51:23,3,Boa noite muitos filmes bons não estão disponíveis no Brasil gostaria de saber o porquê !,Positiva
33646,33647,2020-04-08 21:22:42,3,Não aparece a opção de idioma português no filme Cela 7,Negativa
33679,33680,2020-04-08 20:53:30,3,"O aplicativo é bom,só que está faltando as outras temporadas de Naruto shippuden pq desse jeito não dá 🤦🏽‍♂️",Positiva
33686,33687,2020-04-08 20:47:00,3,"Então app ótimo tiramdo o fato não ter todos episódios de Naruto Shippuden, e nem Boruto ai por favor se vocês adicionarem todos episódios de Naruto Shippuden e Boruto concerteza vocês irão ter mais lucro.",Positiva
33702,33703,2020-04-08 20:24:06,3,"Dúvidas , ótimo aplicativo só não estou conseguindo acessá na tv pode de dizer o pq ?",Positiva
33710,33711,2020-04-08 20:13:57,3,Deveria ajusta o áudio as vezes muda a voz dos personaguem,Negativa
33720,33721,2020-04-08 19:52:07,3,"ja foi um paa bom,pagamos pra ver filmes que temos gratuitos em outros app,inclusive as temporadas de rhe walkinded esta atrasdissima,enquanto outros app gratuitos estao na 10° temporada a netflix parou na 8° #pessimo isso,nao vale a pena pagar",Positiva
33796,33797,2020-04-08 18:20:52,3,"Tô dando 3 nessa bagaça, pq tiraram a opção de remover do ""continuar assistindo"", era perfeita essa opção, agr não tem mais, puts grila Netflix.",Negativa
33808,33809,2020-04-08 18:12:39,3,Melhorou depois que colocaram mais animes do Studio Ghibli.,Positiva
33810,33811,2020-04-08 18:09:50,3,"Quero assinar a Netflix, porém só farei isso quando houver a opção de boleto, super chato isso de ter que colocar algum tipo de cartão.",Positiva
33814,33815,2020-04-08 18:03:54,3,Filmes velhos,Positiva
33835,33836,2020-04-08 17:44:06,3,Vou aprovar para ver,Negativa
33864,33865,2020-04-08 17:04:44,3,Cader a 3 temporada de shanara? acho otimo aplicativo,Positiva
33906,33907,2020-04-08 16:17:53,3,Queria saber porque não consigo transmitir d meu celular pra TV,Negativa
33940,33941,2020-04-08 15:45:18,3,"Dou 3 estrelas pq a maioria dos filmes e séries que tem dublagem brasileira, a dublagem nao existe em portugal, gostaria muitooo que isso mudasse 😢😢😢",Positiva
33945,33946,2020-04-08 15:42:42,3,"Muito legal mais é um abeçudo eles tira filmes eu tava querendo assiti um filme que tinha mais não tem mais ,quem concorda",Positiva
33961,33962,2020-04-08 15:26:54,3,"Eu gosto, porém por ser paga é bem atrasada em relação a algumas séries, existem apps grátis mais atualizados!",Positiva
33986,33987,2020-04-08 15:00:42,3,"Frequentemente tem travado muitos filmes e séries,isso atrapalha muito!",Positiva
34064,34065,2020-04-08 13:25:08,3,Gosto muito da netflix.... porém... com relação a atualização dos filmes e séries... deixa muito a desejar.... demora muito... enquanto que outro aplicativos os filmes saem do cinema e já ficam disponíveis Para que os usuários assistam... e isso já faz anos... e não resolvem esse problema.... melhor repensarem essa postura... pois o cliente nessecita de respeito...,Negativa
34121,34122,2020-04-08 11:34:43,3,Poderia ter mais atualização de filmes .. filmes novos,Positiva
34141,34142,2020-04-08 10:52:30,3,Péssimo. Não tem Trailer em todos filmes.,Negativa
34198,34199,2020-04-08 05:33:30,3,"Aos desenvolvedores: A Netflix é um otimo streamer só tenho 1 crítica e construtiva, por favor voltem com o modo pic in picture no Android 8.1 ! att Wellington Araújo, usuário dos serviços Netflix!",Positiva
34214,34215,2020-04-08 04:53:55,3,quero o resto de naruto shipuden,Positiva
34249,34250,2020-04-08 03:38:27,3,Eu ñ estou mais conseguindo assistir eu clico na tela do celular para iniciar e fica toda preta,Negativa
34263,34264,2020-04-08 03:14:59,3,"Podia voltar com a série American horror story, com as 8 temporadas..",Positiva
34273,34274,2020-04-08 03:04:14,3,O app e bom mas a questão e porque tem q fica atualizando a Netflix todo dia sendo q atualizei ontem,Negativa
34296,34297,2020-04-08 02:33:09,3,.sem explicações,Positiva
34326,34327,2020-04-08 02:01:43,3,Podia ter mais filme e também filmes antigos,Positiva
34374,34375,2020-04-08 01:08:25,3,Bom app gostaria de saber quando irá sair a próxima temporada da série ( Ragnarok)…?,Positiva
34393,34394,2020-04-08 00:52:05,3,Cadê a quinta temporada de greenleaf? Um monte de série faltando temporada,Positiva
34422,34423,2020-04-08 00:27:37,3,Só tem as mesmas coisas de sempre. E raro colocar filmes novos.,Positiva
34451,34452,2020-04-08 00:03:44,3,As sinopices dos filmes e séries podiam ser mais detalhadas.,Positiva
34484,34485,2020-04-07 23:33:37,3,O App é extremamente bom porém tá faltando um desenho que ñ poderia faltar Steven Universo e Dragon ball,Positiva
34494,34495,2020-04-07 23:24:44,3,O app e muito bom mas para abaixar os episódios ou filmes só 2 vezes cada,Positiva
34502,34503,2020-04-07 23:11:08,3,POR favor coloque a primeira temporada de era uma vez eu do 5 estrelas mas coloquem Eu adoro a Netflix muito bom mesmo mas coloque a a primeira temporada até a última de era uma vez por favor,Positiva
34508,34509,2020-04-07 22:59:23,3,Só acho uma filhadaputagem ficarem cancelando series recém lançadas.,Positiva
34533,34534,2020-04-07 22:28:20,3,"e bom,podiam por Boruto,e outros filmes animes e séries tbm,MANO PQ VCS TIRARAM AS TEMPORADA DE NARUTO SHIPUDEN?por favor poe de volta",Positiva
34626,34627,2020-04-07 20:10:43,3,"E muito""Bom""",Positiva
34633,34634,2020-04-07 20:01:47,3,Muito bom o plobema é que ele é pago mais é bom,Positiva
34683,34684,2020-04-07 18:51:06,3,"ESTÁ TRAVANDO, EU ENTRO EM UM FIMME E A TELA FICA TODA ESCURA E SO FICA O AUDIO. OU SO IMAGEM SEM AUDIO. RESOLVAM ISSO!",Negativa
34685,34686,2020-04-07 18:49:24,3,Ainda vou esperar o cadastro,Negativa
34686,34687,2020-04-07 18:48:09,3,Parem de fazer séries com 1 temporada! Investe nas boas e continua! Um saco assistir uma serie boa e vcs cancelam!,Positiva
34699,34700,2020-04-07 18:30:55,3,Nao consigo baichar,Negativa
34743,34744,2020-04-07 17:32:49,3,A Netflix e boa mais falta filmes mais atualizados,Positiva
34763,34764,2020-04-07 17:08:24,3,E bom mais trava sempre e tem que a tualiza sempre,Positiva
34769,34770,2020-04-07 17:02:54,3,Eu dou 3 estrelas porque na configuração do minha lista não consigo mais salvar os meus preferidos,Positiva
34781,34782,2020-04-07 16:43:00,3,Depois que atualizou parou de funcionar,Negativa
34789,34790,2020-04-07 16:30:02,3,"Eu gosto muito das séries e dos filmes, mais acho q deveria ter mais conteúdo LGBTQ, e animes LGBTQ tipo yaois, é isso♡",Positiva
34838,34839,2020-04-07 15:25:16,3,Boa.mas as vezes demora de mais para os filmes chegarem,Positiva
34855,34856,2020-04-07 15:08:03,3,Com essa atualizaçao ficou tudo em ingles ate msm os que ja assisti em portugues agora nao tem a opçao d portugues concertem por favor.,Negativa
34865,34866,2020-04-07 14:55:46,3,Todas as séries e filmes original Netflix são muitos bons,Positiva
34875,34876,2020-04-07 14:48:03,3,É só um quebra-galho. No PC oferece maior qualidade. Esse oferece vídeos muito comprimidos.,Positiva
34879,34880,2020-04-07 14:44:50,3,"é muito legal esse filmes €, ? muita? ! ruin lega é esse dilema",Positiva
34914,34915,2020-04-07 13:54:48,3,Então! A Netflix sempre foi perfeita! Mas agora a Minha Lista não está funcionando!,Positiva
34934,34935,2020-04-07 13:22:22,3,Vou dá cinco estrelas só quando colocar cinquenta tons liberdade eu adoro esse filma por favor coloque,Positiva
34941,34942,2020-04-07 13:06:42,3,"estou dando 3 estrelas pois,meu celular,fica travando na tela,a imagem fica congelada e o audio continua,alem de eu nâo conseguir colocar itens na minha lista,por favor,arrumem isso,pois eu também uso a netflix no computador e não trava,no celular,ja tentei desinstalar e instalar de novo e nada,por favor criadores,arrumem isso,",Negativa
34989,34990,2020-04-07 11:05:48,3,Vcs poderia atualizar as séries mais Rápido tipo Waldead já está na temporada 10 desde do ano passado e vcs não atualizar,Positiva
35000,35001,2020-04-07 10:10:30,3,"Eu não tô conseguindo ver os vídeos, na hora que eu abro eles, a tela fica toda escura e só da pra ouvir as vozes dos personagens, e muitas vezes ela também fica travada.",Negativa
35004,35005,2020-04-07 09:31:06,3,"Queria q tivesse mas episódios de naruto Shippuden, tem muito pouco e os filme q o naruto esta presente tbm poderia ser postado lá... Por favor coloquem quero muito assistir",Positiva
35017,35018,2020-04-07 07:43:06,3,"O App é bom, mas tem momentos em que trava sozinho e nao abra nada. Agora estou a instalar de novo, pk ja não abria mais. Tomara que desta vez, venha a melhorar. Concertem isso por favor. Por isso dei 3 estrelas",Negativa
35031,35032,2020-04-07 06:24:42,3,"Infelizmente eu to tendo o desconforto de quando coloco espanhol ou inglês em alguma série, todo o resto de séries fica em espanhol, isso é chato, resolvam !",Negativa
35034,35035,2020-04-07 06:06:40,3,"O EP 10 de raio negro não tem em português (Brasil), tá estranho",Negativa
35052,35053,2020-04-07 05:08:43,3,O App é muito bom!! Eu so estou com dificuldades para fazer o pagamento do mês,Positiva
35100,35101,2020-04-07 03:28:18,3,E maio bom porque não tem muitos desenhos o filmes de terro e filme de comedia e anime,Positiva
35142,35143,2020-04-07 02:35:04,3,Ele é bom aplicativo mais demora muito a entrar,Positiva
35153,35154,2020-04-07 02:26:50,3,Mais ou m3nos,Positiva
35180,35181,2020-04-07 01:54:30,3,"App bom,porém não atualiza as séries e nem filmes",Positiva
35181,35182,2020-04-07 01:53:02,3,"Bom, pra ficar ótimo e eu dar 5 estrela, eu não encontro filme que eu gostaria de assistir. Filmes mais antigo muitos filmes que pesquiso não tem. Eu faço pesquisa de filmes que gostaria de assistir e não tem filmes mais antigo, por exemplo, só quando eu encontrar os filmes que busco na pesquisa, aí sim eu dou 5 estrelas.eu assisto através do YouTube por que não encontro na netflix",Positiva
35183,35184,2020-04-07 01:51:36,3,🇧🇷🇧🇷🇧🇷🇧🇷🇧🇷🇧🇷🇧🇷🇧🇷❤❤❤❤❤🍰🤣 Hiago,Positiva
35224,35225,2020-04-07 01:12:35,3,"Gosto muito do app, mas a Série Era uma Vez só tem a partir da 3 temporada como que assisto assim ? 😒",Positiva
35242,35243,2020-04-07 00:56:37,3,"O app não quer abrir nem com reza braba, já desinstalei e instalei novamente, porém de nada adiantou.",Negativa
35269,35270,2020-04-07 00:31:30,3,"É otimo ,porém era para ter uma senha nas telas de cada pessoa para ninguém mecher em alguma coisa",Positiva
35302,35303,2020-04-07 00:04:52,3,Tem poucos filmes actuais e não tem as melhores séries do momento,Positiva
35368,35369,2020-04-06 21:48:28,3,"É um app muito bom !!!! Me arrependo + ou - de ter assinado , tiraram uma série que eu queria muito ver : Hannibal 😭 , assinei a Netflix por causa dele e agora tiraram ele 😭😭",Positiva
35385,35386,2020-04-06 21:28:27,3,"O aplicativo e bom, porém não tem como mais repetir as séries, agora tem que esperar de ano em ano presta não tem que corrigir isso pó e logo conto com vocês.",Negativa
35528,35529,2020-04-06 18:40:15,3,Bom aplicativo mais cada vez está subindo mais o valor daqui a pouco vai estar inacessível a muitos...,Negativa
35578,35579,2020-04-06 17:36:44,3,"EU acho ótimo o aplicativo mas a coisa que eu mais ODEIO é que eles tira desenhos,filmes,séries sem nem dar a opção para agente se agente quer que tire aquele filme Arrumem por favor",Positiva
35604,35605,2020-04-06 16:58:52,3,"Eu acho que vocês deveriam ter mais opções de filmes do tipo antigo, principalmente os de terror.",Positiva
35606,35607,2020-04-06 16:57:30,3,"Não consigo mais selecionar e desselecionar itens em ""minhs lista"". O player apresenta travamento durante a reprodução já há algum tempo. A organização dos itens sempre foi péssima.",Negativa
35665,35666,2020-04-06 15:23:27,3,Muito comercial..,Positiva
35677,35678,2020-04-06 15:03:08,3,"Vcs bem que poderiam colocar mais episódio de Naruto Shippuuden, só tem até temporada 5. Bora vê isso ai. Tem mto mais capítulo cara, faz tempo que vcs não atualizam esse anime.",Positiva
35680,35681,2020-04-06 14:56:53,3,"gente, e a promoção???",Positiva
35689,35690,2020-04-06 14:38:52,3,"É bom o app, mas meu celular quebrou e pega a parte de cima e não deita , então eu não consegui me cadastrar..",Negativa
35708,35709,2020-04-06 14:07:30,3,Eu amei a Netflix mais nn tem todos os filmes q vc as vezes pesquisa deveria ter,Positiva
35714,35715,2020-04-06 13:45:33,3,Amei ♥️,Positiva
35737,35738,2020-04-06 13:04:28,3,"Não gostei muito, para ele demora pra achar e.mails",Positiva
35764,35765,2020-04-06 11:32:31,3,Excelente roda liso mas o problema é que quando toca um áudio do Whatsapp a série/filme pausada despausa e isso é muito chato,Negativa
35770,35771,2020-04-06 11:11:05,3,"A alguns dias, não consigo assistir nada off line, tudo dá erro, e até quando estou no wifi, as séries que baixei não carregam. Melhorem isso!",Negativa
35800,35801,2020-04-06 07:52:27,3,Depois da última atualização não está salvando mais no minha lista.,Negativa
35847,35848,2020-04-06 04:09:15,3,Depois das últimas atualizações o aplicativo vem apresentando alguns travamentos no início das séries,Negativa
35863,35864,2020-04-06 03:32:44,3,Falta mais filmes novos,Positiva
35873,35874,2020-04-06 03:21:14,3,Volta Anne,Positiva
35894,35895,2020-04-06 02:48:00,3,"Só acho que vocês tem que investir mais em (doramas) kdramas, Cdramas e Jdramas",Positiva
35946,35947,2020-04-06 01:38:43,3,"Quando eu vou colocar a conta não entra, diz que está incorreta.",Negativa
35957,35958,2020-04-06 01:17:40,3,"Oi, tem um bug acontecendo... assim que deixo o vídeo parado e saio do aplicativo, ao abrir outro aplicativo e ver um status ou stories o vídeo no Netflix continua de onde eu havia parado e só é possível ouvir. Se possível lança uma atualização corrigindo isso ... Tmj Netflix e obrigado por ser uma excelente plataforma.",Negativa
35991,35992,2020-04-06 00:39:41,3,"O aplicativo é bom! Mas ja tem uns dias que o app fica deletando todos os filmes salvos e fica baixando novamente automaticamente. Isso todo os dias. Quando entro no app para assistir minha série, ele já tem deletado todos os episódios e está baixando novamente do episódio 1 da primeira temporada até o último. Consertem isso por favor. Meu celular está com memória mais do que suficiente: mais de 10 gigas disponíveis de 30 no total!",Negativa
36003,36004,2020-04-06 00:30:46,3,"Eu gosto muito da Netflix, mais tem um probleminha, tem que renovar os filmes de criança, e quando tira colocar uns tão sem graça, é a mesma coisa das séries já não tem séries Boas e já tirar o que tem .... Não vai demora muito a Netflix vai fica pra trás porque tá saindo tantos recursos, um aparelho excelente que tem filmes em lançamentos e séries....",Positiva
36013,36014,2020-04-06 00:16:17,3,"Eu sou realmente muito fã da plataforma. Acho uma das ideias mais geniais do nosso século em questão de mobilidade em series. So que falta o rei leão versão original, aquela em desenho 🙄 #ajudaainetflix.",Positiva
36019,36020,2020-04-06 00:08:28,3,Seria melhor se tivesse mais filmes de lançamento!,Positiva
36055,36056,2020-04-05 23:31:24,3,Só falta implementar a opção de acelerar os vídeos.,Positiva
36062,36063,2020-04-05 23:26:44,3,"Comprei um Xiaomi mi 9 lite, e o aplicativo não e compatível, quando vou ver um filme ou série não aparece a imagem sai apenas o som, tive que baixar o app de outra plataforma.",Negativa
36088,36089,2020-04-05 23:03:36,3,"Por favor, coloque no app função para limitar uso de banda no download. Sempre que vou baixar, o uso 100% da minha banda prejudica muito. Obrigado",Negativa
36134,36135,2020-04-05 22:03:57,3,"Ótimo aplicativo porem, não estou conseguindo assistir as séries pois trava e fica com a tela preta e só saindo o som, já desinstalei ele e nada resolveu a problema não está aqui, e sim ai poderia verificar e resolver esse problema o quanto antes",Negativa
36138,36139,2020-04-05 21:59:04,3,Adoro este app,Positiva
36142,36143,2020-04-05 21:51:07,3,App perfeito. A função de dowloud perfeito. Só podiam disponibilizar temporadas mais rápido.,Positiva
36193,36194,2020-04-05 20:54:43,3,"Foram removidas muitas séries das quais eu gostava, por isso não vou dar 5 estrelas",Positiva
36246,36247,2020-04-05 19:30:37,3,Deveria ter a opção de escolher o país.,Positiva
36252,36253,2020-04-05 19:23:30,3,Ele tira filmes bons depois de 1 ano o filme volta isso e bem chato mas o app e bom,Positiva
36265,36266,2020-04-05 19:00:29,3,Após a última atualização não reproduz em segundo plano,Negativa
36267,36268,2020-04-05 18:57:47,3,têm me deixado incomodada porque a opção minha lista sempre tem dado problema na questão de: não consigo tirar nem colocar nada nela,Negativa
36279,36280,2020-04-05 18:39:28,3,Estou com problema pra acessar o aplicativo de vcs fiz o cadastro e o app que eu baixei não entra o programa de vcs queria um suporte pra solucionar esse problema.,Negativa
36283,36284,2020-04-05 18:30:23,3,Muito bacana a videoteca virtual. Minha queixa é o preço alto e falta de inúmeros títulos antigos.,Positiva
36323,36324,2020-04-05 17:35:47,3,"Ótima, mas precisa atualizar na séries, colocar novas coisas.",Positiva
36363,36364,2020-04-05 16:48:39,3,😐,NaN
36374,36375,2020-04-05 16:38:58,3,Volta com The Original's,Positiva
36398,36399,2020-04-05 16:11:39,3,"Muito bom mas nao dou 4 ou 5 eatrelas pq muitas series e filmes, sao removidos, e as series que ficaram nao despertam meu enteresse",Positiva
36418,36419,2020-04-05 15:52:30,3,"App está instável ao ser utilizado em conjunto com o Chromecast. Por vezes, não se conecta.",Negativa
36447,36448,2020-04-05 15:12:54,3,"Netflix, ponham mais filmes recentemente lançados. A Amazon Prime dá um banho em vocês no quesito filme. #FicaaDica",Positiva
36451,36452,2020-04-05 15:04:15,3,Alguiem sabe como cambiar el precio a dinero de mi pais porque me aparace el dolar,Negativa
36452,36453,2020-04-05 15:03:52,3,Só tem filme velho,Positiva
36488,36489,2020-04-05 13:48:36,3,"Muito bom de utilizar, porém os filmes são ultrapassado, falta upload de filmes mais novos.",Positiva
36495,36496,2020-04-05 13:25:51,3,"O aplicativo só fica carregando o vídeo toda hora, 4° parte de la casa de papel saiu más não da pra assistir porque fica carregando toda hora!!",Negativa
36511,36512,2020-04-05 12:40:19,3,Deixando a Desejar,Negativa
36573,36574,2020-04-05 06:27:00,3,"O app é muito bom,mas no meu celular a10 está apresentando muitos problemas como travamento de imagem e naquela janela flutuante a mesma coisa esta acontecendo.",Negativa
36577,36578,2020-04-05 06:08:40,3,Dou 3 estrelas pelo motivo de que não estou conseguindo espelhá-lo na tv.,Negativa
36586,36587,2020-04-05 05:29:14,3,Netflix boto chica vambiro mas saio um episodio errado no episodio 50 a pavilova bebe água sendo que ela é vampira,Positiva
36604,36605,2020-04-05 04:34:40,3,"O aplicativo é ótimo, sempre usei , porém na última atualização não consigo acessar minha conta , consta como senha inválida sendo que a mesma está certa ! Deveria resolver esse bug",Negativa
36611,36612,2020-04-05 04:18:28,3,O app e maravilhoso mais não consigo baixar no meu xiaomi😔,Positiva
36622,36623,2020-04-05 04:02:18,3,Sempre gostei da Netflix. Mas as séries estão repetitivas. Cadê as opções de filmes? Creio que falte mais.,Positiva
36637,36638,2020-04-05 03:35:34,3,O áudio continua mas a imagem Fica preta,Negativa
