,Unnamed: 0,Date,Rating,Review,Classification
48,49,2020-05-29 02:04:55,3,Tem algumas séries com temporada faltando,Positiva
103,104,2020-05-29 01:06:31,3,Não esta favorável a mim pq as séries q eu gosto não estão disponíveis ..,Positiva
133,134,2020-05-29 00:03:21,3,Ele é ótimo só que está tirando muitos filmes e séries legais eu pesso que ponha mais filmes e séries e coloca os devolta,Positiva
147,148,2020-05-28 23:48:42,3,"Vou dar três estrelas, por ter descontado assim que cadastrei o cartão, estava no anúncio que era um mês grátis. Mas o app em si é bom, tem vários filmes ótimos.",Positiva
186,187,2020-05-28 23:12:25,3,"O app é bom pq tem varios filmes e series e da pra baixar e ver ate sem internet , porem tem mtos filmes que tinham ai e tiraram , poderiam colocar e n tira os filmes",Positiva
201,202,2020-05-28 22:57:28,3,A Netflix tá deixando a desejar no q diz respeito à colocar mais Filmes de ação atualizado. Tá muito repetitivo. Precisa inovar.,Negativa
213,214,2020-05-28 22:45:18,3,"E ótimo, só demoram muito pra atualiza os filmes e séries e inclusive tenho um pedido a fazer poderiam colocá American Horror store pfvr kkk tô doido praa ver essa série",Positiva
220,221,2020-05-28 22:41:18,3,"Estou a ver episódios de Grandes acontecimentos da segunda guerra mundial a cores e a qualidade das legendas em português é muito má, nalguns casos distorcendo completamente a mensagem. Melhorem o controlo de qualidade, por favor, ou vão perder um cliente",Negativa
237,238,2020-05-28 21:58:50,3,Devem colocar melhores filmes!!!,Positiva
251,252,2020-05-28 21:43:27,3,"E bom, só que poderia ter mais variedade de filmes, voltar com os antigos e colocar novos tbm",Positiva
273,274,2020-05-28 21:17:12,3,Pr fvr dumblar naruto shippudenn,Positiva
287,288,2020-05-28 20:51:10,3,Gosto muito mais acho que deveria ter mais cuidado com nossas conta pra ninguém usa,Positiva
290,291,2020-05-28 20:49:23,3,"Olá e um ótimo aplicativo mas quando atualiza vem dando alguns erros, como por exemplo não tem imagem tanto em filmes quanto séries, se puderem arrumar esse problema eu agradeço!!",Positiva
294,295,2020-05-28 20:41:58,3,"Gosto muito do netflix, com uma restrição em relação a legenda, que poderia ser na cor amarela, pq quem tem problema de visão e mais fácil de ler, pois em cenário que e branco, não da pra ler a legenda, pensa ....",Positiva
298,299,2020-05-28 20:34:35,3,"Está dando erro toda hora. Tenho que reiniciar o App toda hora que estou assistindo. Celular é novo, Galaxy A50",Negativa
339,340,2020-05-28 19:03:40,3,Melhor App de séries e filmes só que poderia ter mais filmes de hoje em dia demora 3 anos para colocar um filme ñ estou brincando e as vezes trava do nada outra coisa o YouTube tem muito mais vídeo (filme séries)e é grátis a Netflix poderia ser grátis porque tem vários problemas poderia ser grátis pois ñ satisfaz muitas das vezes dica ai😆,Positiva
403,404,2020-05-28 17:22:15,3,"Estava assistindo a série Mako Mermaids, o app tirou a 1, 2 e 3 temporada, estava MUITO bom e saiu, tô triste. Gostaria muito que voltasse as temporadas anteriores 😔.",Positiva
412,413,2020-05-28 17:11:17,3,"A maioria dos filmes que eu procuro pra assistir , não tem.",Positiva
415,416,2020-05-28 17:05:12,3,A Netflix e fraca de anime tem que ter mais animes ...,Positiva
420,421,2020-05-28 16:54:40,3,"Oi netflix tudo bem? Se algum de vcs virem isso, gente por favor dublem naruto shippuden por favor, acabou no meio do anime, vcs poderiam continuar com os mesmos dubladores antigos mais botar novos pra dublar os personagens novos tbm, pfv. Os fans do Brasil daquela epoca cometeram um erro mesmo, mais agora todo mundo quer q naruto shippuden volte a ser dublado até o final pfv.",Positiva
428,429,2020-05-28 16:27:31,3,Mt bom pra assistir mais tem filme q ainda n tem e novos episódios em séries ok arrumem isso Netflix,Positiva
461,462,2020-05-28 15:51:42,3,E mt bom o app mas a net tirou Gravity falls um desenho animado mt bom,Positiva
465,466,2020-05-28 15:45:26,3,"O aplicativo é ótimo, mas a retirada de alguns filmes e séries não era pra acontecer. Estava assistindo sou luna e derrepente retiraram e eu amo essa série, aff.....!!",Positiva
511,512,2020-05-28 14:12:08,3,Falta muitos animes,Positiva
541,542,2020-05-28 13:16:36,3,Seria melhor se tivesse a opção de pagar por boleto !,Positiva
570,571,2020-05-28 12:18:11,3,Poderia ter os filmes da Disney👌😔,Positiva
584,585,2020-05-28 11:43:08,3,É legal o problema é porque às vezes somem de desenhos que a gente quer assistir mas fora isso é legal★★★✩✩,Positiva
587,588,2020-05-28 11:39:54,3,"Eu fiquei esperando por meio ano pra lançar anime dublado, o trailer do em breve tava dublado tudo tava dublado (eu acho) ,eu não sou daqueles que não acredita em covid, mais tirar a dublagem pronta e sacanagem, e se não tava dublado pelo menos não deveria mostrar o trailer . Essa foi minha crítica construtiva",Positiva
592,593,2020-05-28 11:24:23,3,Nossa eu adorei a Netflix mas só precisa ter mais filmes ☺,Positiva
602,603,2020-05-28 10:35:16,3,Precisamos de novos filmes,Positiva
626,627,2020-05-28 07:59:27,3,Boa pra ver séries já filmes... Catálogo muito pobre!,Positiva
631,632,2020-05-28 07:35:08,3,"Bom! Belo app mais eu acho que deveria colocar mais animes, e tambem,colocar os animes que tiraram, tirando isso otimo app!!",Positiva
637,638,2020-05-28 06:25:41,3,"Não sei que aconteceu depois que atualizou simplesmente fica dando erro da Netflix e fica congelando a série ou o filme é saindo do app ,acho que pode melhorar",Negativa
702,703,2020-05-28 03:38:41,3,"O conteúdo é bom, mais uma série, que eu amo muito, saiu, "" meninas superpoderosas"", essa série saiu pq? Aconteceu algum problema? So para vcs saberem, estou decepcionada, e quero me retirar nessa situação, vão me responder? Acho bom! E tem mais! Umas vezes o App fica dizendo ""ouvi uma falha no servidor, tente novamente mais tarde"" E assim, quando espero e volto, da o aviso novamente, depois eu reinicio a entrar no app, E AI EU VEJO QUE A NETFLIX SAIU!! Eu estou tão indignada [ °\ ~ /°]",Negativa
725,726,2020-05-28 02:58:44,3,A minha imagem não para de travar mais o som continua rodando isso ta enchendo muito o saco já é a terceira vez que desistalo é instalo de novo assim não da,Negativa
728,729,2020-05-28 02:55:45,3,O que aconteceu com Reign? aparece 4 temporadas e quando eu vou assistir só tem a 1,Negativa
734,735,2020-05-28 02:33:19,3,Achava otimo mas agora não estou gostando eles deixam uma serie pela metade so com algumas temporadas e tem poucas opções teen so entra filmes e series de terror não acho mais series que custumava achar,Positiva
743,744,2020-05-28 02:24:12,3,"era maravilhoso o app o único problema é que eles tiraram as series que a Disney produziu, os filmes... tudo, um conselho? se eu fosse querer audiência eu colocaria todos novamente, e não só por que eu quero mas todos que eu conheço também acham que isso é um problema, e na quarentena iriam ganhar muito assinantes",Positiva
746,747,2020-05-28 02:21:18,3,Poderia ter o suporte de atendimento no idioma do país que opera. Só tem suporte em inglês.,Negativa
749,750,2020-05-28 02:17:39,3,Netflix é muito bom mas deixa a desejar quando o app ficar parando do nada,Positiva
759,760,2020-05-28 02:03:38,3,É bom mais tem filmes que tem dublado mais na Netflix não é dublado isso e errado ele tem que ver isso,Positiva
762,763,2020-05-28 01:59:04,3,É orivel,Negativa
790,791,2020-05-28 01:19:48,3,"Já tava bom de dar uma reduzida no valor, tá perdendo vários filmes e séries e caríssimo comparada a concorrência, meus dias na Netflix estão contados.",Negativa
798,799,2020-05-28 01:09:31,3,Na smart tv está péssimo o som desde o último final de semana,Negativa
799,800,2020-05-28 01:08:12,3,Depois que atualizou as series começaram a travar e dar problemas no carregamento...,Negativa
800,801,2020-05-28 01:06:03,3,This is the best app ever!!,Positiva
807,808,2020-05-28 00:55:46,3,Demora na atualização de filmes e séries,Positiva
837,838,2020-05-28 00:18:39,3,#supernatural,NaN
853,854,2020-05-28 00:03:20,3,Gostaria de ver a série o bom doutor e também the flash 6 temporada .,Positiva
855,856,2020-05-28 00:02:00,3,Mantos Bommm,Positiva
871,872,2020-05-27 23:48:15,3,Não está aparecendo as séries que eu gosto!!!?????,Positiva
872,873,2020-05-27 23:48:08,3,Na raba toma tapão ksksk,Positiva
880,881,2020-05-27 23:23:27,3,Bom tem que melhorar de filmes Lançamentos ldldkdmfmdndnddnd,Positiva
888,889,2020-05-27 23:17:45,3,Séria muito melhor se nós pudéssemos remover que série ou filme do parte continuar assistindo de um jeito mais fácil,Positiva
924,925,2020-05-27 22:26:50,3,"Dando bug toda hora quando vai atualizar os dados do cartão de crédito, arrumem isso por favor.",Negativa
941,942,2020-05-27 21:53:45,3,Tem séries que estão incompletas como the flash que não chegou a 6 temporada ainda. mas tirando isso tudo é bom,Positiva
1000,1001,2020-05-27 20:30:02,3,"Tava ótimo... Mas de repente começou a travar e interromper o clímax do filme. Não é a internet, é o sistema. Por favor, como melhorar isso?!",Negativa
1003,1004,2020-05-27 20:25:56,3,"Um ótimoaplicativo mas ultimamente estou tendo problemas pra assistir no meu celular, ele fica travando e estou tendo dificuldades pra entrar.",Negativa
1005,1006,2020-05-27 20:22:24,3,Estou com dificuldade de excluir filmes da lista de continuar assistindo no celular.,Negativa
1011,1012,2020-05-27 19:09:23,3,Horrivel,Negativa
1024,1025,2020-05-27 18:50:19,3,Deveria ter mais séries românticas q nao seja da china,Positiva
1041,1042,2020-05-27 18:20:00,3,Por favor retornem. Funco de retirar da fila de assistindo.um saco ter que fazer todos processo la na conta pra retirar e inda no tá dando certo .está ótimo com essa função direto como estava,Negativa
1044,1045,2020-05-27 18:13:15,3,App muito bom só porém tiram séries muito boas do app assim como supernatural mano tem que volta com a temporada 14,Positiva
1045,1046,2020-05-27 18:11:36,3,Não tira o filo house por favor,Positiva
1090,1091,2020-05-27 16:49:30,3,"Bom ,mas, demora muito meses para libera novas temporadas",Positiva
1121,1122,2020-05-27 16:03:43,3,Não estou conseguindo entrar na Netflix arrumem isso,Negativa
1131,1132,2020-05-27 15:52:35,3,Não consigo acessar minha conta senha e email estão corretos e não consigo entrar,Negativa
1144,1145,2020-05-27 15:19:47,3,Deveria poder baixar tudo u.u,Positiva
1159,1160,2020-05-27 15:00:45,3,So baixo se tiver naruto shippuden dublado Netflix dubla naruto,Positiva
1167,1168,2020-05-27 14:48:18,3,"Será que dá pra parar de reduzir a qualidade da resoluçao enquanto assisto, POR FAVOR?! Ja marquei a opçao de sempre utilizar HD e tenho 200mb de internet, so que o app persiste em reduzir ate 480p no meio da programaçao sem motivo nenhum(e ainda trava e reinicia) Isso ja ta chato, passou da hora, 2 atualizaçoes e nada de corrigir",Negativa
1183,1184,2020-05-27 14:26:23,3,"Pior a cada atualização, nessa última, não é mais compatível c Chromecast",Negativa
1191,1192,2020-05-27 14:15:08,3,"ta faltando mais episodeos de naruto,e falta filme",Positiva
1192,1193,2020-05-27 14:11:04,3,"É muito bom, mas tinha que ter uma opção nas configurações para dispositivos registrados, pra gente saber quantos aparelhos e quais estão com a nossa conta.",Positiva
1198,1199,2020-05-27 13:58:35,3,Ele é bom só que eu coloquei o Gmail da primeira vez e foi depois saio e eu tinha que colocar de novo eu coloquei o mesmo Gmail e não foi ficava dando Gmail incorreto e eu uso o Gmail da minha prima e ela mesma colocou e não foi,Negativa
1220,1221,2020-05-27 12:40:19,3,"Amo o app mas mesmo n baixando nada, não consigo baixar meu filmes",Positiva
1224,1225,2020-05-27 12:35:02,3,ĺ9,NaN
1262,1263,2020-05-27 10:36:27,3,Só tem que respeitar a religião dos outros viu porta dos fundos e netflix,Negativa
1264,1265,2020-05-27 10:21:54,3,A Netflix tira muitos filmes e séries boas por isso eu estou dando 3 estrelas e também vcs demoram demais para colocar as temporadas de séries e filmes,Positiva
1290,1291,2020-05-27 06:39:24,3,Ahhhh... E BOM,Positiva
1312,1313,2020-05-27 05:02:47,3,Bugs para atualizar os episódios Eu acabo de ver o episódio porem o histórico de visualização travou em apenas um ep e não sai dele,Negativa
1316,1317,2020-05-27 04:40:20,3,A cada atualização o apk fica pior existem apk grátis bem melhor que este que e pago se não melhorar vou acabar cancelando a assinatura,Negativa
1321,1322,2020-05-27 04:27:07,3,Só posso dizer que é bom . Há aplicativos melhores de este!,Positiva
1400,1401,2020-05-27 02:02:11,3,"Estou tendo problemas com o carregamento, o vídeo trava ou o áudio. Arrumem, por favor!!!!",Negativa
1422,1423,2020-05-27 01:32:32,3,Eu acho um absurdo pq eu tava asistindo uma seria quando vi a netfilx a apagou meu perfil ISO NAO SE FAZ PO,Negativa
1428,1429,2020-05-27 01:27:24,3,Podia ser mais atualizado !,Positiva
1433,1434,2020-05-27 01:17:10,3,O aplicativo em si é bom mais não entendi o porquê ele tá todo em inglês 🙄 não dá nem pra ler as descrições antes de escolher assistir alguma coisa...,Positiva
1452,1453,2020-05-27 00:51:05,3,"Está dando erro nos vídeos das series, fica carregando e não entra nunca na série está cada vez pior",Negativa
1454,1455,2020-05-27 00:47:25,3,Fica dando erro Quase todas as vezes enquanto está assistindo Arrumem isso,Negativa
1466,1467,2020-05-27 00:33:47,3,"Tinha esse aplicativo, descontado o valor em cta bancária. Qdo recebi aviso de renovar a cta. Chequei meus extratos e percebi que os 2 ultimos não tinha caído na cta. Isso tudo sem ter recebido aviso algum. Optei por desistência. Desculpa me mas ,não confio mais em vcs. O sit gui fire e do meu neto",Negativa
1483,1484,2020-05-27 00:11:22,3,Normalmente muito filme ruim,Negativa
1491,1492,2020-05-26 23:58:47,3,"Legal o app porém, tem que evoluir vai tempo que a qualidade estar deixando a desejar!",Positiva
1555,1556,2020-05-26 22:48:23,3,Não consigo baixar o volume quando conecto do celular para TV fica meio q bugado nem aumenta ou baixa .,Negativa
1577,1578,2020-05-26 22:19:03,3,Não estou conseguindo entrar no App coloca email e senha tudo certo e o App diz que está iincorreto Mesmo redefinindo a senha.,Negativa
1580,1581,2020-05-26 22:16:21,3,Não consigo usar tela dividida no meu a30,Negativa
1592,1593,2020-05-26 22:00:05,3,É um bom app mas ultimamente ta travando muito a imagem para e o áudio continua saio e entro dnv mas fica do mesmo jeito,Negativa
1604,1605,2020-05-26 21:41:07,3,Muito Boa,Positiva
1609,1610,2020-05-26 21:38:49,3,Está saindo toda hora sozinho,Negativa
1611,1612,2020-05-26 21:33:55,3,A netflix não ta indo a serie que eu tava assistindo não que ir em portuques antes tava indo em portuques e não ta aparesendo o idioma portuques fais uque,Negativa
1645,1646,2020-05-26 20:44:19,3,E bom mais tem que melhorar mais o conteúdo,Positiva
1654,1655,2020-05-26 20:29:47,3,Não entendo porque nos perfis infantis não tem como bloquear a tela...,Positiva
1657,1658,2020-05-26 20:27:52,3,Não estou conseguindo atualizar,Negativa
1674,1675,2020-05-26 19:58:28,3,Muito bom esse App instalei para ver minha série(sete pecados capitais)porém tive q reinstalar pq teve uma hora q só pegava o som e a imagem ficava preta,Negativa
1683,1684,2020-05-26 19:47:50,3,"Tenho utilizado o Edge para assistir, pois o aplicativo do windows é muito limitado. Além de faltar as animações como no navegador, ele tem o audio comprimido, parece que não envolve, como no Chrome. A imagem no aplicativo do windows tem muito brilho, porém apesar de ter mais resolução que no Chrome, ela perde toda definição de cores por conta do brilho estourado.",Negativa
1694,1695,2020-05-26 19:28:16,3,Toda vez q vou assistir alguma coisa Da erro Não sei oq fazer...,Negativa
1695,1696,2020-05-26 19:27:16,3,Precisa de mais k-dramas,Positiva
1702,1703,2020-05-26 19:17:27,3,Cade o naruto shippuden não tem filmes nao tem episodios da tem porada 6 mano bota ai por favor,Positiva
1718,1719,2020-05-26 18:50:19,3,poucas opções boas e atualizadas e está ficando cada vez mais caro a plataforma,Negativa
1744,1745,2020-05-26 18:10:25,3,Estava funcionando super bem .. de um tempo parou 😭😭,Positiva
1766,1767,2020-05-26 17:43:44,3,Nao to conseguindo abri os videos💔,Negativa
1827,1828,2020-05-26 16:23:38,3,"Porque diabos o meu vídeo fica ""pausando"" automaticamente ?",Negativa
1839,1840,2020-05-26 16:10:14,3,Eu assinei a netfix para assistir naruto classico e shipudem mas quando eu cheguei no ep 112 de naruto shipudem fiquei frustado pq não tem a continiação de naruto shipuden mesmo se os episodios nao fossem dublados em portugues eu aposto que isso não é motivo para não assistir. Netflix por favor quero naruto completo pelomenos legendado em portugues . pf ;-; . eu daria 5 estrelas mas pelo naruto dou 3,Positiva
1856,1857,2020-05-26 15:46:44,3,"Para de botar ""número inválido""isso e chata tá",Negativa
1876,1877,2020-05-26 15:07:43,3,"Oi bom eu só queria falar que eu amo o Netflix mas só no da TV no do celular, ipad , etc é ourives quase tudo é pago nessa vida credo eu acho que como a maioria das pessoas gostam do Netflix poderia ser gratuito e alguns filmes ou séries pagos mais só alguns.",Positiva
1882,1883,2020-05-26 14:47:24,3,Eu não consigo assistir e nem baixar o app novamente no meu tablet. 😣,Negativa
1899,1900,2020-05-26 14:01:05,3,Eu não do à 5 estrelas por que as serie não são completas e também não tem filmes que outros aplicativos tem mais não pegua mais,Positiva
1907,1908,2020-05-26 13:43:37,3,"Estou dando apenas três estrelas,pois lá há muitos filmes antigos que passam direto na televisão,em meu argumento queria declarar que por mim só deixaria os filmes novos; no entanto, não só estou dando três estrelas por causa desse problema que acabei de citar,e sim por motivo como a Netflix é um pouco atrasada,pois conheço um app que não tem play story e ainda por cima não paga nada,tendo muitos lançamentos de filmes e séries que chegam mais rápido, e as vezes tem mais temporadas que a Netflix",Positiva
1908,1909,2020-05-26 13:37:55,3,Faz a 2 temporada da aucademia!,Positiva
1935,1936,2020-05-26 12:11:09,3,"ta de sacanagem ne netflix?Já n bastava ter serie pela metade agora tirando filmes !o app é muito bom mais pra que tirar filmes que são bons e colocar outros lixo ?primeiro shrek depois o magico de oz e em seguida a princesa e o sapo! pra que isso ,serio pra que comsertem esse erro por favor!!!",Negativa
1955,1956,2020-05-26 09:48:30,3,Continuem com Daybreak pfv💕,Positiva
1967,1968,2020-05-26 06:51:42,3,Uma vez conectar para se divertir bons filmes da Netflix,Positiva
1968,1969,2020-05-26 06:35:50,3,Coloca uma opção para aumentar a velocidade do vídeo,Positiva
1986,1987,2020-05-26 04:53:57,3,Não consegui deixar em segundo plano,Negativa
1996,1997,2020-05-26 04:15:28,3,ALGM ME EXPLICA PQ APARECE ERRO DE LOGIN SENDO QUE TA TUDO CERTO,Negativa
2009,2010,2020-05-26 03:20:10,3,"Uso tablet com sistema Android 8.1 e ainda informa q talvez n seja um app otimizado para meu aparelho,q por sinal comprei esse mês. Q sistema Android é necessário 😒?",Negativa
2011,2012,2020-05-26 03:14:38,3,"inicialmente estava funcionando tudo bem, mas depois de um tempo começou a só ser reproduzido o áudio e aparecer as legendas porém a imagem não era apresentada era somente uma tela preta",Negativa
2012,2013,2020-05-26 03:09:01,3,É boa👍🏻,Positiva
2029,2030,2020-05-26 02:17:28,3,O app até que é bom mas não tem boku no hero ou my hero academia isso e sacanagem vocês podem até fazer a voz em português não tem poblema se a voz ficar ruim oque importa é que alguem dublou,Positiva
2045,2046,2020-05-26 01:55:40,3,"Aprendo inglês com filmes e séries da netflix. Tenho 2 sugestões: ter a opção de voltar 5 segundos em vez de 10. E quando eu trocar o idioma ou a legenda, não tirar do pause automaticamente o episódio ou o filme. Quando eu pauso e mudo o idioma ou a legenda, o filme automaticamente volta a rodar. Eu queria q o filme continuasse pausado, p eu comparar as legendas. (Pq uso para aprender idioma). Mais 1 observação: colocar avaliação de 1 a 5 estrelas para todos os filmes/series e mostrar isso",Negativa
2084,2085,2020-05-26 00:45:40,3,Eu estou estressada coloco a senha certa e mesmo assim diz que está errada! Mudei a senha e está do mesmo jeito!,Negativa
2098,2099,2020-05-26 00:30:28,3,Tem algumas série que não está pega do no meu celular,Negativa
2100,2101,2020-05-26 00:29:47,3,Estou avaliando o app,Positiva
2115,2116,2020-05-26 00:15:40,3,Galera eu quero mais temporadas de Naruto Shippuden por isso dei três,Positiva
2137,2138,2020-05-25 23:49:40,3,Cadê as novas temporadas de bob esponja em !,Positiva
2157,2158,2020-05-25 23:22:07,3,Nunca consigo acha os filmes e séries que eu quero,Positiva
2165,2166,2020-05-25 23:08:51,3,Minha tela fica preta toda vez q eu entro no app,Negativa
2179,2180,2020-05-25 22:50:09,3,"Muito bom,só não achei alguns filmes",Positiva
2180,2181,2020-05-25 22:47:57,3,Rateio,Positiva
2188,2189,2020-05-25 22:38:42,3,Trava muito o aplicativo!,Positiva
2195,2196,2020-05-25 22:32:05,3,"Deveriam lançar as novas temporadas das séries logo, demoram mais de ano para atualizar nesta plataforma.",Positiva
2211,2212,2020-05-25 22:10:00,3,A Netflix é legal mas o último problema que ela então boa noite consegui abaixar mas já vi a minha,Positiva
2218,2219,2020-05-25 21:59:33,3,"App bom mais podia ser de graça sei q não dá pra ser de graça mais qual é,tem vários Apps com as mesmas séries sem ser pago,só tô aq pq quero ver as séries legendados aí não consegui.",Positiva
2237,2238,2020-05-25 21:38:53,3,"É bom mais poderia ser melhor,fies mais atuais,ect",Positiva
2242,2243,2020-05-25 21:33:23,3,Gente pra assistir uma série e filme tem que pagar faz um ingual mais sem pagar com cartão de crédito e débito,Negativa
2260,2261,2020-05-25 20:37:06,3,"Eu nao tenho nada a reclama da netflix e otima e amo os filmes , mas tenho so a reclama sobre a serie elite e muita ponografia muito sobre drogas e sexo acho desnecesssario isso",Positiva
2264,2265,2020-05-25 20:16:54,3,Bom !eu amo mas não é gratuito,Positiva
2274,2275,2020-05-25 20:02:11,3,As visitas ttava,Positiva
2306,2307,2020-05-25 19:05:23,3,Bom app,Positiva
2310,2311,2020-05-25 18:53:47,3,Poucos filmes,Positiva
2321,2322,2020-05-25 18:29:07,3,podia ser melhor mais e muito bom,Positiva
2327,2328,2020-05-25 18:23:42,3,E o melhor aplicativo que eu já abaixei para assistir mas podiam atualizar as séries muitas séries estão só na primeira temporada só isso por favor atualizem as temporadas 👍👍,Positiva
2380,2381,2020-05-25 16:45:37,3,"Boa tarde, eu usava Netflix no Cel, sem querer eu tive q desinstalar o aplicativo, agora instalei, e coloco a senha e email e fala q tá incorreto, mais tá certo oq será.",Negativa
2386,2387,2020-05-25 16:38:52,3,Só tem filme antigo mas filmes bons,Positiva
2394,2395,2020-05-25 16:27:00,3,Por enquanto melhor que o prime vídeo.,Positiva
2429,2430,2020-05-25 15:32:34,3,"Não gostei do jeito que é organizado a Netflixl, porque acho difícil ficar procurando os filmes, a Netflix deveria organizar tudo que abrimos com títulos dos filmes, e organizar tudo por categoria, tipo comédia, ação, romance, lutas, a Netflix deveria ter filmes melhores.",Positiva
2432,2433,2020-05-25 15:29:40,3,"Vocês precisam arrumar esse problema da legenda e áudio. Mesmo mudando, todo início de episódio de uma série, a configuração reseta. É cansativo ter que ligar ou desligar legenda e alterar o áudio toda vez que vou abrir um episódio novo.",Negativa
2452,2453,2020-05-25 15:00:33,3,Poderia ter mais filmes lançamentos,Positiva
2471,2472,2020-05-25 14:26:26,3,E realmente de ótima qualidade mais a quarta temporada de Riverdale não chega na minha conta,Positiva
2473,2474,2020-05-25 14:24:31,3,Eles podiam lançar todas todas as temporadas de Naruto Shippuden até virar o sétimo Hokage,Positiva
2476,2477,2020-05-25 14:23:21,3,"Desde ontem não estou conseguindo acessar a Netflix nem no celular e nem na televisão. O app simplesmente não abre, por favor resolvam isso.",Negativa
2502,2503,2020-05-25 13:44:45,3,Muito bom e ao mesmo tempo ruim,Positiva
2543,2544,2020-05-25 11:44:07,3,3 por não ter a 2 temporada de one puch man,Positiva
2553,2554,2020-05-25 11:10:43,3,Tem muito filme antigo e as séries demoram muito p lançar novas temporadas odiei,Positiva
2563,2564,2020-05-25 10:09:56,3,"EU GOSTAVA DA NETFLIX MAIS EU PAREI DE GOSTA NO MOMENTO EM QUE TIRARAM POKEMON X E Y,EU QUERO DE VOLTA SE NAO EU VOU DENUNCIAR.😠👿🖕🖕",Positiva
2590,2591,2020-05-25 05:24:21,3,Ainda tô baixando,Negativa
2613,2614,2020-05-25 04:22:07,3,N vou aumentar minha nota até eles dublarem naruto Shippuden tô certo!,Positiva
2661,2662,2020-05-25 02:48:48,3,É LEGAL mais tão cancelando muitas séries legais 🤨🥰,Positiva
2665,2666,2020-05-25 02:45:31,3,"No começo estava muito bom, mas de uns dias pra cá só está travando, n consigo nem assisti uma série, pfvr arrumem isso",Negativa
2680,2681,2020-05-25 02:24:42,3,Eu amo esse app,Positiva
2697,2698,2020-05-25 01:59:05,3,E muito bom recomendo,Positiva
2699,2700,2020-05-25 01:57:12,3,5f,NaN
2705,2706,2020-05-25 01:47:58,3,"A Netflix é ótima, porém tem outros aplicativos que tem filmes e séries que a Netflix não tem, vocês poderiam ver isso.",Positiva
2709,2710,2020-05-25 01:36:35,3,Bom so acho muito atrasado com as series pode atualizar as series pelos lansamentos .,Positiva
2733,2734,2020-05-25 00:42:57,3,"O controle de velocidade dos vídeos foi retirado. Poderiam recolocar,por favor?!?",Positiva
