,Unnamed: 0,Date,Rating,Review,Classification
50453,453,2020-03-27 10:15:34,3,"Depois da última atualização, não funcionava mais. Tive que desinstalar o aplicativo e reinstalar para voltar a funcionar...",Negativa
50473,473,2020-03-26 13:31:20,3,Eu quero a 2º temporada de henry danger,Positiva
50480,480,2020-03-26 00:34:20,3,"Tive a péssima supresa de que os downloads não acontecem em segundo plano. Não tem como deixar a tela ligada todo o tempo pois o mimoso do IPhone ou Netflix, tanto faz, não estão se entendendo. Que decepção essa droga!",Negativa
50493,493,2020-03-25 02:23:39,3,"Sugiro que aumentem o numero de telas que da pra assistir ao mesmo tempo de acordo com o plano assinado
Por exemplo o plano premium tem 5 oposições de perfis porém só dar pra assistir em 4 ao mesmo tempo, seria bom se desse pra assistir os 5 ao mesmo tempo",Negativa
50530,530,2020-03-22 16:38:33,3,"In general the app is not bad but in my opinion needs more investing in UI based on UX. Also, the connection between the app and chromecast is horrible. Very very bad. It seems this aspect has been overlooked by Netflix.",Negativa
50547,547,2020-03-21 14:42:39,3,"Não consigo configurar! Ex.: excluir perfil 
Não encontro um filtro pra ir na linha de filmes que mais gosto 
Quando seleciono meu perfil aparece poucas opções de filmes e nessas poucas ainda há muitos repetidos",Positiva
50558,558,2020-03-20 21:25:25,3,"Atualizei o app na smartv e a qualidade não está mais boa em nenhuma série ou filme ! E não é internet pois YouTube e globoplay está rodando tudo em fullhd , creio que seja algum erro da atualização do app !",Negativa
50559,559,2020-03-20 21:16:23,3,"A plataforma Netflix é fantástica!!! Sou assinante a 1 ano e um bocado! Nunca tive problema nenhum, EXCETO, agora! Por algum motivo, a Netflix NÃO está abrindo no meu IPhone 8 Plus. Em todos outros dispositivos da conta (TV, notebook, androids) o app abre. E não há motivo para não abrir, estando conectado a uma forte rede de internet! Resolvam o problema por favor!!!",Negativa
50570,570,2020-03-19 21:37:54,3,"Email addresses associated with secondary profiles should be used to sign in to my account, because its bad to give my primary email to my cousin...  we can change everything.... and that is bad",Negativa
50583,583,2020-03-19 00:57:48,3,"Seria incrível uma opção de apagar de forma manual filmes e séries que ficam na aba “ continuar assistindo”
Ja não primeira nem a segunda vez, que assim que termino uma série continua na aba assistir mais tarde",Positiva
50594,594,2020-03-18 19:38:23,3,"Gostaria muito que vocês coloquem novamente a Série supernatural dos Irmãos Sam e Dean, por favor coloquem novamente.",Positiva
50607,607,2020-03-18 00:25:25,3,Essa balela de versão de aparelho para abaixar o app ta por fora👎. Nunca que vou trocar um aparelho por um mais caro pra satisfazer conchave de NETFLIX E APPLE 💪🏿,Negativa
50609,609,2020-03-17 23:23:10,3,"Não consigo conectar a Netflix com minha tv😕
Como faço?",Negativa
50614,614,2020-03-17 16:06:55,3,Nao esta abrindo no ios 😦😦😦,Negativa
50624,624,2020-03-16 18:19:39,3,"Não está baixando os filme para assistir off-line, o app não carrega direto e só trava",Negativa
50627,627,2020-03-16 15:42:10,3,"O App vive parando no iPhone, tenho que reinstalar toda vez 🤦🏽‍♀️",Negativa
50650,650,2020-03-15 03:16:15,3,"Está dando erro pra tentar mais tarde toda vez que eu começo assistir uma série, assisto um pouco e da erro! Aí quando clico de novo pra entrar volta lá atrás 😡😡😡
Arrumem isso! 😓😡😡",Negativa
50654,654,2020-03-14 23:46:49,3,"simplesmente não abre,fica falando que a senha esta incorreta.
sendo que está certa.
esse problema já acontecem com varios familiares meus",Negativa
50657,657,2020-03-14 17:37:57,3,"querida, arruma esse bug, já troquei de senha 30 vezes pq o app diz que a senha inserida está incorreta, plmds, resolve aí",Negativa
50667,667,2020-03-14 00:57:37,3,Arrumem!,Negativa
50669,669,2020-03-14 00:01:14,3,"Estou há meses tendo problema em acessar a conta devido sempre constar que a senha está incorreta, sendo que não está. Sendo assim, ou preciso ficar sempre redefinindo a senha, ou deixo ativado o login automático. Mas caso eu queira conectar outro dispositivo, não consigo porque consta “senha incorreta”. Já redefini mais de cinco vezes e continua do mesmo jeito, há algo de errado!",Negativa
50670,670,2020-03-13 23:06:27,3,Não estou mais conseguindo achar o botão de compartilhamento para o Chromecast :(,Negativa
50676,676,2020-03-13 02:59:23,3,"Tá horrível o aplicativo, toda vez que vou entrar no app, tem que desinstalar e instalar de novo porque simplesmente não abre..",Negativa
50688,688,2020-03-12 02:57:12,3,"NETFLIX se vcs poderem fazer novos episódios de Ever After High eu tó aceitando pq n pode acaba daquele jeito.(3 estrelas tbm pq vc tá tirando minhas temporadas favoritas em séries e tbm tão tirando filmes q eu amo , é só isso)",Positiva
50689,689,2020-03-12 01:49:29,3,"O que vocês fizeram com a função “pip”? Era ótimo poder assistir um filme enquanto eu fazia outra coisa, agora não tenho mais essa opção. Consertem isso por favor.",Negativa
50702,702,2020-03-09 02:24:21,3,"Não consigo mais baixar episódios, aparece uma mensagem falando que atingiu meu limite de dowlond , sendo que não tenho nenhum episódio baixado",Negativa
50709,709,2020-03-08 20:52:55,3,O voice over não consegue clicar no ícone para clacificar,Negativa
50713,713,2020-03-08 19:36:27,3,"A cada ano fica mais caro e a cada ano perdem tiram séries e filmes maravilhosos do catálogo, melhorem isso.",Negativa
50717,717,2020-03-08 16:04:22,3,"Demora muito pra abrir ou não abre, está difícil quase impossível esse app",Negativa
50722,722,2020-03-08 13:43:34,3,Tem que se pagar e eu sou criança... acho que o mundo tá a ficar louco com o dinheiro,Positiva
50740,740,2020-03-06 18:00:05,3,"Não consigo acessar minha conta no app, quando vou acessar fala que minha senha ou email está incorreto sendo que meu e-mail e senha está CORRETOOO! Arrumem isso por favor.",Negativa
50751,751,2020-03-05 16:02:02,3,"Estava assistindo uma série e do nada, de uma hora para outra mudou o idioma... e não tem como retornar... aff!🤦🏻‍♀️",Negativa
50763,763,2020-03-04 00:43:18,3,Não está abrindo no iPhone 7 pq???,Negativa
50766,766,2020-03-03 18:40:02,3,"O Netflix vem se provando com o tempo e é de fato um excelente stream de filmes e séries, porém o aplicativo pela Apple Store continuamente possui erros e falhas voltados à conexão em chromecast e outros aparelhos para espelhamento em TV que realmente torna a experiência frustrante para o usuário, problema do qual nunca experienciei na Amazon Prime.",Negativa
50778,778,2020-03-02 12:00:19,3,Tipo minecraft Story mode e Naruto shippuden faltam episódios e temporadas.,Positiva
50781,781,2020-03-01 22:49:35,3,Na minha tb e todas as outras da minha casa ñ está entrando,Positiva
50795,795,2020-03-01 00:12:36,3,Não consigo acessar a minha conta!! Mesmo colocando a senha e o e-mail correto,Negativa
50808,808,2020-02-28 00:05:39,3,"O app está com  bug, quando colocado algumas das séries ou filmes no modo off-line, quando exclui ou da erro de download ele não é deletado da memória do celular. O único jeito é desinstalar o app e reinstalar novamente. Mas agora com isso ocorre toda vez que baixo alguma coisa e preciso liberar memória para baixar outra coisa, o app não está mais deixando eu fazer o loading diz que está incorreto a senha ou que não existe a conta.",Negativa
50811,811,2020-02-27 18:33:11,3,Vocês poderiam adicionar algo para nós tirarmos print!,Positiva
50833,833,2020-02-24 10:14:48,3,"Gosto da Netflix mas o fato de não ser possível adicionar senha a um perfil específico para que somente o usuário do perfil tenha acesso a ele me deixa bastante frustrado e preocupado, aqui por exemplo, tenho o plano família e mesmo com um perfil infantil configurado nada impede que a criança tenha acesso a um outro perfil em que não haja restrição de conteúdo, que os responsáveis pela implementação de novas funcionalidades se atentem a isso pois é algo de estrema importância.",Negativa
50842,842,2020-02-22 05:38:34,3,"Toda vez que vou baixar alguma episódio seja ele da série qu for só fica com o nome baixando e não sai do canto e olha q minha net e de 50 mb, melhorem isso 👎 já pagamos caro pelo serviço pelo menos o app tem q funciona direito!!",Negativa
50844,844,2020-02-22 00:04:04,3,"Eu gosto muito mas vcs so pagam para fazer fime besta tem series q tem mais temporada e vcs mao coloca!!!
Eu quero a 4 temporada de garotos de lugar nenhum!!!
A gente paga so para entrar 5 fimes e series novas por ano, quero a 4 temporada, se nao entrar vou cansela a assinatura, no começo era a melhor coisa mas agora nao e mais, vejao Netflix e pelo menos coloca a 4 temporada logo tem umas 3 series ai q nao tem todas as temporadas",Positiva
50858,858,2020-02-19 23:23:52,3,"Não abre, só fica carregando",Negativa
50862,862,2020-02-19 04:24:52,3,Nao esta indo de geito nenhum... arrumen pois so asisto na tv!,Negativa
50879,879,2020-02-16 16:37:54,3,O app e bom a única coisa que eu não gostei e porque tiraram Pokémon XYZ,Positiva
50888,888,2020-02-14 18:03:11,3,Não dá para pagar com conta Apple,Negativa
50890,890,2020-02-14 05:12:56,3,"Demora uma eternidade pra abrir no iPhone 7 mds arrumem, thanks",Negativa
50893,893,2020-02-13 19:32:22,3,Eu acho que deveria ter opção de filmes a vontade os filme que eu gostaria de assistir não tem no App acho que pra ser um App top de linha deveria ter recursos de filmes não só de autoria da Netflix mais sim de outras categoria também pra que vocês possa satisfazer as vontades dos clientes .,Positiva
50897,897,2020-02-13 12:33:29,3,"Não está baixando mais os capítulos das séries, da que atingi o limite de downloads do ano sendo que a série tem 4 temporadas e nunca baixei mais de uma vez o mesmo título no iOS.",Negativa
50905,905,2020-02-12 12:32:26,3,"o meu aplicativo não entra, com e sem internet/wifi",Negativa
50908,908,2020-02-12 00:23:34,3,Pode arrumar isso fica carregando e nunca vai,Negativa
50909,909,2020-02-11 21:39:32,3,"T6 E4 de Vikings, sem dublagem e legenda não acompanha o vídeo",Negativa
50927,927,2020-02-09 12:30:50,3,"O 4º episódio da 6ª temporada de vikings está com problemas na legenda. Estão descoordenadas com as vozes. Atualizem, urgente!!",Negativa
50929,929,2020-02-09 00:26:01,3,"Esperava mais do app, pq passa um século pra atualizar uma série e filmes nem se fala, quando colocam depois de um século colocam inglês aff ninguém merece🤦🏻‍♀️",Negativa
50949,949,2020-02-06 16:44:15,3,"Está muito ruim! 
App não abre, reinstalo e não abre mesmo assim.
Não fale que é a internet pois temos um ótimo pacote",Negativa
50953,953,2020-02-06 02:51:35,3,"Não abre, fica carregando e não entra de jeito nenhum",Negativa
50954,954,2020-02-05 23:58:16,3,"Eu amo a Netflix, Mas eu fiquei muito triste que não tem Big Bang Theory. Netflix Coloca novamente Big Bang Theory EU nunca te pedi nada.",Positiva
50965,965,2020-02-04 17:15:24,3,"Ótimo App, tem para todos os gostos e, recomendo muito acho q todos tem q ter, muito melhor q tv e a melhor coisa é que não tem propaganda kkkkk",Positiva
50983,983,2020-02-01 20:58:44,3,A dublagem tem bugado e as falas acontecem antes dos personagens falarem,Negativa
50998,998,2020-01-30 16:41:58,3,"as legendas em português só são do português europeu, e tem expressões que nós brasileiros não entendemos. isso é chato, deveria ter as duas opções",Negativa
51009,1009,2020-01-29 12:36:08,3,Se você gosta meu o Pokémon sol e lua só tem alguns episódio E naruto a mesma coisa:(,Positiva
51016,1016,2020-01-28 21:31:58,3,"Achei o app ótimo, mas sinto falta de um “modo off-line” nem que fosse premium, ou algo assim.Porque alguns dos filmes e episódios não estão disponíveis para fazer o download, e também em séries com muitas temporadas, sempre tiram a primeira temporada e não da para assistir o resto!",Positiva
51038,1038,2020-01-26 02:16:52,3,"É de fato bom, mas não está mais disponível no meu IOS, definitivamente deveria ser disponível para qualquer dispositivo.",Negativa
51043,1043,2020-01-24 19:17:29,3,"O aplicativo em si é bom, séries boas, plataforma boa e etc. Porém queria mais coisas no catálogo, se vc for ver o catálogo de filmes da Netflix USA esta cheio de coisas que aqui não tem, além do mais nao vejo a necessidade de tirar filmes e séries do catálogo, faz falta. 
Só quero um novo catálogo com as mesmas coisas que os USA tem, não é justo",Positiva
51044,1044,2020-01-24 19:11:34,3,toda vez que eu baixo algum ep de série a Netflix não deixa reproduzir off-line ou tira as legendas e tbm muitas vezes quando eu ligo o Wi-Fi tudo volta a funcionar ou seja isso de poder ver quando quiser e off-line n é verdade.,Negativa
51061,1061,2020-01-22 16:21:07,3,Não esta abrindo página do login no iOS 12.1,Negativa
51063,1063,2020-01-22 08:31:40,3,"no meu celular (Iphone Xs) quando tento baixar séries e filmes funciona, mas quando tento com o da minha mãe não vai!
Não é o problema com a internet pois com a mesma a utilizei para baixar os meus ... como vão resolver?",Negativa
51070,1070,2020-01-20 23:23:10,3,"Poderia ter como ver a capa do filme/série em tela cheia e mostrar mais informações como ano de lançamento, título original, mostrar o nome em forma de texto, talvez infos do IMDb... De resto, tudo ok.",Positiva
51090,1090,2020-01-18 18:25:10,3,"Atualizem os conteúdos!! Adicionem novas séries mais teens românticas....

Adicionem mais séries asiáticas !

Obs:
A love so beautiful 
Extraordinary You 
....",Positiva
51095,1095,2020-01-18 04:10:32,3,Porem não tem Titanic. Se tivesse seria melhor,Positiva
51098,1098,2020-01-18 00:38:32,3,Poim Pfv a SEGUNDA TEMPORADA DO (MI SCORE GIRL). Eu amei o anime,Positiva
51099,1099,2020-01-17 21:42:19,3,"Não sétimo que acontecendo, mas o app no celular não consigo acessar. A tela fica escura e não aparece nada. Tento de tudo, mas não vai. Alguém sabe o porque?",Negativa
51103,1103,2020-01-17 15:11:47,3,Ultimamente está horrível coloco os filmes para assistir e para no 99 porcento e o filme não abre minha internet é 20 de download 20 upload Help,Negativa
51106,1106,2020-01-17 01:42:17,3,Depois dessa atualização não esta mais abrindo o aplicativo,Negativa
51107,1107,2020-01-17 00:49:50,3,"Oiiiiii, o app N está baixando no iPad e fica C mttt bug",Negativa
51132,1132,2020-01-14 01:35:25,3,A minha tela está fechando sozinha. Depois não consigo mais logar.,Negativa
51137,1137,2020-01-13 02:08:24,3,Sempre que quero assistir pelo cell tenho que desinstalar e instalar p conseguir assistir!! 🙄😡,Negativa
51138,1138,2020-01-13 01:12:10,3,"Muitos títulos que apresentam vários idiomas e legendas não estão com todas as opções, como na tv..",Positiva
51139,1139,2020-01-12 23:42:36,3,"Ao tentar acessar Netflix fazendo pareamento iPhone, Google Chrome Cast, o Netflix fica carregando às vezes por muito tempo, sendo necessário desconectar, fechar aplicativos e entrar novamente.",Negativa
51143,1143,2020-01-12 15:17:01,3,Depois de atualizar para o iOS 13.3 as legendas ficaram pequenas e o tamanho não é alterado mesmo indo as definições de legendas no iPhone. Nem mudando o tamanho nas definições da Netflix,Negativa
51145,1145,2020-01-12 06:17:26,3,"O app é muito bom, no entanto, ele ocupa muito espaço ao baixar séries e ao excluir, ele continua ocupando o mesmo espaço, este app estava com 15GB em meu aparelho",Negativa
51146,1146,2020-01-12 04:36:58,3,"Toda vez q tento abrir o app pela primeira vez no dia dica numa tela escura e não abre, me obrigando a fechar o app e o reiniciar.",Negativa
51153,1153,2020-01-11 01:42:13,3,"Seleciono para fazer download de episódio e tem hora q não vai, tenho q ficar conferindo quando o app quer ou não funcionar",Negativa
51172,1172,2020-01-09 16:15:18,3,"Muito bom, mas eu acho que deveriam ter mais filmes principalmente novos filmes da atualidade. Queria que chegasse alguns filmes mais rápidos",Positiva
51184,1184,2020-01-08 17:35:40,3,Depois da ultima atualização as legendas ficaram muito pequenas e mesmo depois de reconfigurar elas não aumentam.,Negativa
51191,1191,2020-01-07 18:31:46,3,"Quando clica no aplicativo, a tela do celular fica escura e não aparece nenhum filme",Negativa
51195,1195,2020-01-07 09:55:04,3,"não consigo baixar nada , quando clico no botão a tela fecha sozinha . pfvr conserta isso",Negativa
51215,1215,2020-01-05 18:58:27,3,"A netflix podia ter as séries completas, eu quero terminar Naruto Shippuden",Positiva
51221,1221,2020-01-05 01:23:39,3,"Email e senha certa 
Não consigo logar
Diz q a senha esta errada",Negativa
51236,1236,2020-01-03 21:00:28,3,"a Netflix precisa urgentemente atualizar o app para dar a opção do usuário de assistir com  o aparelho na vertical. Eu assisto muito no meu tablet, mas as vezes gostaria de assistir com o aparelho na vertical, n precisar virar ele, ja que mesmo na vertical ele tem uma resolução de largura ótima. 
Claro q na horizontal é o ideal, mas o app deveria disponibilizar as opções para q os usuários escolhessem.",Positiva
51243,1243,2020-01-03 01:41:07,3,A Netflix vai tirar greisanatomi que faz eu odiar ela é só tem filme antigo e chato,Negativa
51251,1251,2020-01-02 02:51:48,3,Que tipo de aplicativos para filmes e séries não tem Friends?,Positiva
51268,1268,2019-12-31 06:50:39,3,Não tem todas as temporadas de naruto shippuden,Positiva
51269,1269,2019-12-31 05:20:22,3,"Então, o app é bom mais eu estava torcendo para q saísse saiki kusuo em português e saiu! O problema é que as dublagens estão ruins e a voz do Nendo parece de um traficante, sugiro que melhorem isso e se n poderem por favor tirem as vozes dubladas e deixem só a legenda obg
Ps:estava falando de (saiki kusue nun psi nan reativado) ;)",Positiva
51279,1279,2019-12-30 12:31:13,3,Minha nota 3 estrelas vai para a empresa NetFlix que está cada vez perdendo mercado e conteúdos para os concorrentes.,Negativa
51280,1280,2019-12-30 02:30:07,3,Pelos dados móveis o aplicativo informa que não há conexão disponível e assim só funciona via Wi-Fi.,Negativa
51288,1288,2019-12-29 00:53:43,3,"Gostaria que tivesse mais filmes atuais, mais variedade no geral.",Positiva
51297,1297,2019-12-28 18:10:19,3,o meu app fica tirando do meu perfil toda hora que eu saio aff,Negativa
51309,1309,2019-12-27 05:30:16,3,Lançando poucos filmes tem muitos filmes bons que não tem na Netflix muitos mesmo deixando de assinar pra assinar tele cine e Amazon prime,Negativa
51312,1312,2019-12-27 02:13:45,3,Atualize pra nova versão do IOS,Negativa
51314,1314,2019-12-26 22:25:21,3,É bom dms mais ñ tem um anime que quero assistir mais o resto é bom,Positiva
51321,1321,2019-12-26 04:47:36,3,"Eu venho usando a Netflix desde o ano passado,a Netflix é muito boa.Mas eu tive q desinstalar só pra eu conseguir um negocio,e quando eu fui instalar de novo,n consegui,meu celular é iPhone 5S e n esta dando pra INSTALAR POXA",Negativa
51322,1322,2019-12-26 03:40:49,3,"Tenho dois androids que possuem essa função, porém no iPhone não consigo...",Negativa
51326,1326,2019-12-26 00:56:14,3,"Oi pessoal, não estou conseguindo mais acessar a Netflix pelo meu IPhone :/",Negativa
51329,1329,2019-12-25 19:38:24,3,"Do nada sumiu todos os perfis e a lista de filmes e séries, e ainda ficou em espanhol",Negativa
51334,1334,2019-12-25 02:58:59,3,é bom porém não tem a mesma versão no androide eu acho,Positiva
51335,1335,2019-12-24 20:39:31,3,"O app é muito bom, tem variedades de filmes, séries, desenhos e muito mais. Só que toda vez q eu tento entrar no app pelo celular ele demora MUITO pra entrar e a maioria das vezes eu desisto!",Negativa
51338,1338,2019-12-24 11:42:29,3,"Última atualização, está travando e fechando o App sozinho",Negativa
51342,1342,2019-12-24 02:26:39,3,Gostaria de ver “Beyblade brust evolution” na Netflix. Seria gratificante.,Positiva
51363,1363,2019-12-22 00:43:49,3,"Pela segunda vez em alguns anos como assinante entraram na minha conta e apagaram os perfis.
O perfil principal não pode ser apagado, porém os demais foram, perdendo todo o histórico do que foi assistido e do que estava por vir. De que adianta pagar uma assinatura que permite criar perfis adicionais se esses não têm qualquer segurança ou backup? Uma autenticação de dois fatores tb é algo necessário para evitar qualquer alteração indesejada. Espero que atualizem logo.",Negativa
51369,1369,2019-12-21 17:37:56,3,Tenho iPhone 6 e terei de sair da Netflix pois não é compatível .,Negativa
51380,1380,2019-12-21 00:54:31,3,Eu dei três estrelas pois eu não gostei muito pois não tem séries do harry potter coceis deveriam colocar todos os episódios de harry potter,Positiva
51394,1394,2019-12-19 12:19:58,3,"Estou com um problema pra baixar o aplicativo!!! Socorro 😭😭 não tenho o app baixado no celular, mas no App Store aparece que eu tenho. O que eu faço?",Negativa
51417,1417,2019-12-18 01:44:45,3,Não consigo obter meu link de indicação,Negativa
51418,1418,2019-12-18 01:43:34,3,"Não consigo modificar as legendas mesmo indo nas configurações e salvando as novas mudanças, assim que entro no app do meu celular está do mesmo jeito de antes.",Negativa
51432,1432,2019-12-17 16:14:24,3,Vocês tinham que colocar grey’s anatomy disponível para download,Positiva
51458,1458,2019-12-16 20:24:33,3,Netflix esta um lixo não lança filme bom e quando lança é antigo mas em compensação tem muita série boa como stranger things,Positiva
51465,1465,2019-12-16 03:35:38,3,"Demoram muito para colocar filmes atualizados, quando colocam o filme já não tem mais graça!",Positiva
51479,1479,2019-12-15 16:28:16,3,"Não consigo ver a temporada 1,2,3,4,5,6 só consigo ver a 7 gostava de ver as anteriores",Negativa
51570,1570,2019-12-13 17:18:19,3,Não pega no iPad nesta versão! Pois a minha versão seria a 9.3! Se pudesse disponibilizar a versão seria muito grato,Negativa
51607,1607,2019-12-11 13:53:13,3,Meu filho apagou o App e agora não estou conseguindo baixa-lo na loja da App,Negativa
51641,1641,2019-12-08 01:29:30,3,"Estou tendo problemas para ver filmes no meu IPhone XS da mensagem que não está disponível para este país, sendo que em menos de 5 minutos estava assistindo",Negativa
51665,1665,2019-12-05 14:17:16,3,Está dando erro -80,Negativa
51668,1668,2019-12-05 01:58:04,3,Não consigo fazer download em meu celular,Negativa
51683,1683,2019-12-02 23:43:49,3,Eu queria poder tirar prints de algumas partes de séries mas quando tira um print sai preto não sei se é bug ou não mas por favor deixem eu poder printar algumas partes de séries e me expliquem o motivo disso,Positiva
51688,1688,2019-12-02 17:50:09,3,"Toda vez q acesso o app tem q escolher o perfil que desejo usar, muito chato isso!! Arrume isso.",Negativa
51697,1697,2019-12-01 13:14:01,3,Pq agente criar uma conta brasileira e vc mora no Japão la no brasil todos os filmes sao brasileiros e americanos e aqui so tem poucos filmes dublados e muitos filmes japoneses,Positiva
51703,1703,2019-11-30 16:27:26,3,"Novo iOS, iPhone novo e não consigo pausar usando Chrome Cast! 🙄",Negativa
51707,1707,2019-11-30 12:22:00,3,Acho que deveria ter mais filmes tipo crepúsculo e outros muitos filmes que pesquisamos não tem la,Positiva
51720,1720,2019-11-28 17:25:04,3,"Come Back of Lego Ninjago season 3,4,5 and you can put season 6,7,8,9,10",Positiva
51731,1731,2019-11-27 01:08:37,3,Vcs tiram as coisas e colocam original Netflix e também quando vou assistir a alguns dawlouds ( não sei como escreve). Ele falo que não pode mais ser assistido off-line isso acontece com quase todos os meus dawlouds arrumem por favorzinho 😭😭😭😭,Positiva
51734,1734,2019-11-26 23:37:56,3,"Estou com problemas para assistir o conteúdo na Netflix. Quando assisto alguma série, às vezes a imagem congela e fica aparecendo um contador (como se estivesse carregando o restante do episódio), outras vezes aparece a seguinte mensagem: “Estamos com problemas para reproduzir este título no momento. Tente novamente mais tarde ou selecione outro título.”, e aparece um código no canto inferior direito da tela (tvq-pm-100).

Espero que consertem este problema o mais rápido possível.",Negativa
51735,1735,2019-11-26 22:59:05,3,"Nesta versão no iPhone 11 estou vendo um filme e de repente começa a tocar a música de um trailer na home. Não tem atualização, não tem onde repórter bug",Negativa
51737,1737,2019-11-26 21:57:01,3,"Poderia baixar mais os valores das assinaturas, né Netflix Brasil?",Positiva
51741,1741,2019-11-26 17:30:23,3,Demora uma eternidade pra baixar qualquer título...os downloads deveriam ser mais rápido...e olha que minha internet tem 10 mega,Negativa
51742,1742,2019-11-26 14:47:04,3,"Aconteceu um problema com o meu login, usei meu mês grátis, mês passado e quando acabou esse mês eu fiz o pagamento na mesma hora, continuei usando por meia hora e depois simplesmente o app saiu da netflix, quando eu tentei fazer login novamente, coloquei e-mail e senha, e deu um erro como se minha senha tivesse errada, verifiquei a senha e estava certa, coloquei novamente o login e a senha e deu que o meu login de usuário não existia, e desde então não consigo mais entrar, eu não tenho mais acesso ao e-mail que eu cadastrei a minha netflix pois esqueci a senha, e não consigo entrar mais no e-mail, pois não tenho mais acesso ao numero que estava cadastrado.. vocês poderia me ajudar? pois não quero pagar por uma coisa que eu não consigo usar, e já paguei o mês nem estou usando..",Negativa
