,Unnamed: 0,Date,Rating,Review,Classification
18349,18350,2020-05-01 06:59:55,3,netflix muito top ne mas podem fazer o favor de aficionarem Boku No Hero Academia na categoria animes??? agradecida tchau,Positiva
18389,18390,2020-05-01 04:38:04,3,Eu gosto da Netflix ela tem todas as series mais quando eu comecei a gosta da serie de sou luna elea removeram a serie e tambêm so tinha a 2 temporada e a 3 temporada se eles colocasem de vouta eu acradeseria,Positiva
18391,18392,2020-05-01 04:35:55,3,"A Netflix é boa mas com essa última atualização que teve não consigo mais assistir nada. O App funciona normal, os filmes tbm mas quando vou entrar em um filme para assistir só sai o som, a tela fica toda preta, a imagem do filme não aparece, se possível por favor concertar isso rápido!!",Negativa
18409,18410,2020-05-01 03:40:24,3,Botem mais ep de spirit cavalgando livre academia de equitação,Positiva
18417,18418,2020-05-01 03:29:43,3,Amanda Netflix até que acho bom mas preciso falar velho Netflix Eu acho que eu já vi todos os desenhos e todos os todos os as séries de desenho todas as séries que eu achei da hora eu acho que devia ter mais série de desenho e também mais tarde de filme aí sim aí sim mano que eu daria cinco estrelas para para Netflix se tivesse outra séries Aí sim que eu daria cinco estrelas para Netflix não mas não tem acesso que eu gosto de desenho tipo os sete pecados capitais já assisti ela 9 mil vezes,Positiva
18425,18426,2020-05-01 03:18:44,3,NEFLIX MAI 1 2020 VITOR HUGO SOARES,Positiva
18435,18436,2020-05-01 02:47:12,3,Cadê as temporada de NARUTOOOOOOI!!,Positiva
18444,18445,2020-05-01 02:32:56,3,Eu dei essa nota por causa de um problema e que eu estive esperando pela nona temporada de the walking dead e não veio como eu resolvo esse problema,Positiva
18470,18471,2020-05-01 01:43:43,3,"Os filmes da Netflix estão perdendo para o YouTube ¯\_(ツ)_/¯nem todo mundo quer está assistindo um filme de 2015, mais as séries são",Positiva
18544,18545,2020-05-01 00:13:51,3,"primeiramente o app é bom maaass nao tem a era do gelo e outros filmes meio antiguinhos como coraline, a noiva cadáver e etc. mas o problema mesmo no meu caso é que vocês cancelaram muitos filmes e séries boas ☹️☹️☹️",Positiva
18585,18586,2020-04-30 23:21:52,3,Qual o intuito de vocês criarem um aplicativo no servidor brasileiro sendo que Boa parte dos filmes são em outras línguas? Tem que ser muito doente,Positiva
18597,18598,2020-04-30 22:58:37,3,Está bugado a pessoa acabei um episódio e logo após passou para outro episódio eu tava no ep 22 e passou para o 17 espero que vcs arrumem logo,Negativa
18604,18605,2020-04-30 22:51:49,3,"Tem bastante filmes e séries boas... Mais tem muito palavrões, eu e minha família somos cristãos",Positiva
18643,18644,2020-04-30 22:13:12,3,Caro,Positiva
18644,18645,2020-04-30 22:12:32,3,Todo filme que eu coloco a imagem paralisa e só passa o áudio....,Negativa
18689,18690,2020-04-30 20:48:38,3,Eu queria novos episódio de pokemon sol e lua,Positiva
18705,18706,2020-04-30 20:21:55,3,Muito bom gostei bastantes,Positiva
18718,18719,2020-04-30 19:57:11,3,Muito boa a plataforma mas tem que se atualizar mais rápido pois as séries demoram muito para chegarem as novas temporadas.,Positiva
18720,18721,2020-04-30 19:54:08,3,O aplicativo é bom!,Positiva
18724,18725,2020-04-30 19:43:28,3,"Demora pra atualizar os filmes/séries, além de ter séries cuja temporada só tenha a partir da 4 temporada e filmes na qual não tenha o primeiro ou só tenha o 3 deste, ou seja, Incompleto.",Positiva
18727,18728,2020-04-30 19:38:53,3,Pode colocar o vingadores ultimato,Positiva
18758,18759,2020-04-30 18:26:24,3,"Muito bom, só é muito pesado",Positiva
18766,18767,2020-04-30 18:10:59,3,Falta muitos filmes,Positiva
18822,18823,2020-04-30 16:29:17,3,"Esta zuando com minha cara?? Faz 3 anos q tenho a netiflix e nunca teve comercial, isto ja esta me fazendo perder a cabeça de tanto comercial, a cada 1 ou 2 minutos aparece um. Por favor tirem estes anuncios",Negativa
18827,18828,2020-04-30 16:19:06,3,"Bom o aplicativo, ficaria "" ótimo "" se tivesse mais variedades de filmes novos , pois na Netflix só passa filmes antigos já está passou a hpra de renovar né !!",Positiva
18845,18846,2020-04-30 15:59:11,3,Não tem todos os filmes e nem todas as séries que eu gosto.,Positiva
18866,18867,2020-04-30 15:30:07,3,"Meu app tá dando problema, tenho que desinstalar e instalar todo dia. Passo o dia todo assistindo normal e no outro dia dá erro e pedi pra retornar mais tarde. 🤦🏽‍♀️",Negativa
18881,18882,2020-04-30 15:07:28,3,"Gosto da Netflix, só acho q deveria tê mais variedades de filmes de terror tipo zumbis, vampiros , lobisomem, qnto mais terror mais melhor ...",Positiva
18890,18891,2020-04-30 14:58:38,3,"Gostei porém deveria ter filmes de lançamento, Pois demora muito pra sair filmes de lançamento nesse App.",Positiva
18902,18903,2020-04-30 14:29:11,3,"Ta travando muito,tô tendo que desistalar,e estalar de novo essa e 3 vez que acontece isso.",Negativa
18958,18959,2020-04-30 12:25:34,3,"Muito boa , achei , bem diversificado o programa",Positiva
19005,19006,2020-04-30 06:12:19,3,"Tá bom de colocar game of thrones, the o.c e o restante dos filmes do herry Potter",Positiva
19014,19015,2020-04-30 05:11:36,3,Eu não consigo acessar fica falando que a senha está sendo que está certa,Negativa
19057,19058,2020-04-30 03:25:05,3,"Vou da 3 estrelas,por que a netflix e boa,mais tem muitos filmes bom que a netflix não passa,por isso vou dar apenas 3 estrelas,espero que vcs me entenda,e melhore a netflix",Positiva
19081,19082,2020-04-30 02:42:45,3,Muito otimo o app Mais gostaria as séries Romatica fosse português seria mais top,Positiva
19085,19086,2020-04-30 02:35:33,3,Era muito bom. Gostava da opção de aumentar/diminuir velocidade do vídeo. Cancelei porque não tem mais.,Positiva
19125,19126,2020-04-30 01:23:43,3,O App é ótimo porém depois que ele atualizou ontem só da erro no meu cell ( A30s ),Negativa
19143,19144,2020-04-30 00:57:11,3,Eu não consigo entrar na Netflix,Negativa
19161,19162,2020-04-30 00:34:04,3,A Netflix demora duas decada para lançar uma nova temporada... e os lançamentos de filmes cadê?,Positiva
19216,19217,2020-04-29 23:41:27,3,"Os filmes/series/desenhos ficam travando isso quando não voltam para o início,ou, não volta o episódio alem de o app sair e alguns filmes não ter. Aiai",Negativa
19220,19221,2020-04-29 23:28:59,3,Ruin,Positiva
19242,19243,2020-04-29 22:58:51,3,Eeeeeeee munta serie,Positiva
19254,19255,2020-04-29 22:41:41,3,Esse é o melhor pra ver filmes,Positiva
19263,19264,2020-04-29 22:26:05,3,"Meu celular é um Motorola One Macro , antes eu conseguia assistir filmes e séries em segundo plano e agora não consigo mais , vocês tiraram essa opção ?",Negativa
19291,19292,2020-04-29 21:59:57,3,"perdeu duas estrelas pq eu quero doramas dublados, DORAMAS DUBLADOOOOOOSSS, dublam os doramas pfv ಥ‿ಥ",Positiva
19300,19301,2020-04-29 21:46:15,3,Falta bastante filmes,Positiva
19306,19307,2020-04-29 21:27:47,3,Não gostei muito porque não tem o filme Como treinar o seu Dragão 2 nem o 3 Mais é bom👋🏼👋🏼,Positiva
19325,19326,2020-04-29 21:03:42,3,Cool.,Positiva
19366,19367,2020-04-29 19:43:57,3,"Tá faltando atualizar séries aí em, principalmente the 100 que em outros apps grátis já tem a 6° temporada e na netflix não! Por favor atualizem as séries porquê desse jeito nem vale apena pagar pra assistir na netflix sendo que em outros apps de graça tem muito mais e atualizadas ainda por cima...",Positiva
19377,19378,2020-04-29 19:18:04,3,Não aparece o botão para baixar mais. Até dia 27/04 conseguia baixar e após não consegui mais.,Negativa
19378,19379,2020-04-29 19:16:26,3,Renova Anne Renova Anne Melhor faz 9 temporadas de Anne Faz 9 temporadas de Anne Anne Anne Anne A única coisa boa que vocês fizeram lá,Positiva
19420,19421,2020-04-29 18:10:50,3,"Netflix pelo fato de que vc era a melhor assinatura, e agr na minha opinião é a pior ,envez de todo mundo pagar pq vcs n fazem um espaço vip , seria melhor pois , tem mts outros Apps bem melhores q o seu e q n pagam nada",Negativa
19434,19435,2020-04-29 17:47:14,3,Muito bom de ótima opções.,Positiva
19456,19457,2020-04-29 16:52:40,3,Eu gostei mas falta o anime do boruto Noruto,Positiva
19480,19481,2020-04-29 16:07:15,3,"Só recomenda coisa de bebê , por que vocês tiraram Gravity Falls??? É a minha série favorita.",Positiva
19524,19525,2020-04-29 14:52:32,3,Tava esselente aí começou ah da erro de dois dias pra cá o meu é um A10 atualizo Eu ele tem duas semanas ou até menos .,Negativa
19561,19562,2020-04-29 13:09:06,3,O App e bom mas as vezes trava a imagem e só fica o audio,Negativa
19591,19592,2020-04-29 10:37:20,3,Á maioria dos áudios não esta O vindo em português,Negativa
19605,19606,2020-04-29 06:48:46,3,Trocar o idioma não pode ser completamente difícil tem de estar na tela principalmente quando e cliente e de pais de expressão contrário ao inglês,Negativa
19607,19608,2020-04-29 06:41:12,3,"Depois da última atualização, quando a tela é minimizada a imagem trava. Por favor dêem uma olhada. Agradeço",Negativa
19609,19610,2020-04-29 06:29:48,3,Não tenho do que reclamar muito bom,Positiva
19616,19617,2020-04-29 05:41:30,3,"Muito bom,mas tem um problema que está acontecendo muito,que é aparecer uma mensagem que ""houve uma falha em seu aparelho ou ocorreu uma erro por favor me ajudem a resolver ou arrumem PRECISO DA NETFLIX NESSA QUARENTENA!!!😟",Negativa
19618,19619,2020-04-29 05:15:34,3,Bom mais falta depool e depool 2,Positiva
19631,19632,2020-04-29 04:18:00,3,O aplicativo é muito bom só acho que quase todas as séries ou todas a temporadas não estão completas exemplo Henry danger acho que é minha série predileta eu e as minhas amigas íamos adorar todas as temporadas de Henry danger e talvez o filme se desce,Positiva
19641,19642,2020-04-29 03:51:23,3,Não posso opinar nunca utilizei!¡,Positiva
19694,19695,2020-04-29 02:30:02,3,Eu queria fazer um pedido eu queria a terceira temporada de kally's mashup,Positiva
19730,19731,2020-04-29 01:50:14,3,O aplicativo é otimo. Mas grown-ish desapareceu da minha lista. #grown-ishdevolta.,Positiva
19732,19733,2020-04-29 01:49:03,3,Boa noite queria uma explicação estou tentando atualizar a forma de pagamento mais não estou conseguindo.. aparece a mensagem desculpa tente mais tarde e o site está com problemas está em inglês está com erro alguém mais está assim. Não posso assistir a Netflix por isso erro (-1007),Negativa
19742,19743,2020-04-29 01:36:22,3,Adoro a netflix mais oque está me perturbando muitooooo é que não tem o resto da série do naruto shippuden nem que fosse legendado coloquem pfv,Positiva
19783,19784,2020-04-29 00:53:44,3,"Netflix vocês deverian fazer mais episodios de ""henry danger""",Positiva
19818,19819,2020-04-29 00:07:44,3,"A gente assiste um ep aí tem que esperar meia hora pra assistir outro, ""estamos com problemas para acessar estes títulos"" só fica nisso",Negativa
19820,19821,2020-04-29 00:03:09,3,Meu nao ta baichando,Positiva
19824,19825,2020-04-28 23:58:28,3,"A única coisa que eu e acho q muita gente não gosta é que não é fácil achar os filmes. Ficam sempre te dando as mesmas opções. Pra achar, ou vc sabe o que tá procurando ou procura em sites alguma sugestão",Positiva
19870,19871,2020-04-28 23:03:31,3,"Para um streaming tão grande o catalogo é bem limitado, até um site pirata tem um catalogo mais variado que esse, afff",Positiva
19918,19919,2020-04-28 21:44:15,3,Mano aplicativo e bom mais tem um anime que não foi dublado que o one punch men que e muito legal mais não tem segunda temporada não tem então vocês mesmo podia dublar aí po sei lá por que e bom e muitoooo legal,Positiva
19923,19924,2020-04-28 21:38:05,3,"Falta colocar série e filmes atuais. As séries boas, ou não tem continuidade ou saem. Animes como Naruto está incompleto. Difícil né dona Netflix...",Positiva
19937,19938,2020-04-28 21:10:10,3,"Na realidade é muito boa a plataforma, vale realmente a pena pagar a assinatura, porém a quebra do contrato com a CW foi um terrível acontecimento, na minha percepção, as melhores séries são da CW, ainda mais com a crise das infinitas terras, para quem as assistiu éfriatante saber que tera de usar outros meios para assistir, o que torna duvidoso permanecer na plataforma...",Positiva
19961,19962,2020-04-28 20:17:03,3,Muito bom mas poderia ter a opção de assistir em velocidades mais rápidas.,Positiva
19964,19965,2020-04-28 20:08:08,3,É muito bom... Mas devia melhorar em questão de Filmes de Terror...,Positiva
19978,19979,2020-04-28 19:45:28,3,"Muito bom, melhor app de todos para assistir filmes e séries, até animes tem, porém fiquei chateado que tiraram o Supernatural, a melhor série da minha vida, e acredito que muitas outras pessoas também gostam.",Positiva
19992,19993,2020-04-28 19:18:15,3,Eu só queria que eles parassem de tirar as temporadas das séries programas de comédia e etc mas tirando isso o aplicativo é ótimo mas dou três estrelas,Positiva
20004,20005,2020-04-28 19:02:27,3,E bom despois eu estalo de volta..,Positiva
20034,20035,2020-04-28 18:16:29,3,Boa mas cara,Positiva
20053,20054,2020-04-28 17:54:36,3,O vídeo esta rodando sozinho mesmo quando saio do app. So preciso abrir algum vídeo no store do insta ou Facebook que o vídeo da Netflix abre o áudio e começa a tocar. Ue,Negativa
20060,20061,2020-04-28 17:49:04,3,Alguém me dá a conta da Netflix???????,Negativa
20080,20081,2020-04-28 17:13:33,3,Falta algumas. Séries,Positiva
20109,20110,2020-04-28 16:33:40,3,Bom do mais,Positiva
20131,20132,2020-04-28 15:58:24,3,"O aplicativo é muito bom tem muitos filmes e séries, mais alguns filmes está que nem a Globo pulando algumas partes dos filmes",Positiva
20139,20140,2020-04-28 15:53:19,3,Tem muito a melhora🤫,Positiva
20141,20142,2020-04-28 15:48:38,3,Deveria ter todas as temporadas de naruto shipoden,Positiva
20162,20163,2020-04-28 15:12:59,3,"Tá perfeito, só falta colocar Titanic",Positiva
20182,20183,2020-04-28 14:42:11,3,😊😆😙,NaN
20190,20191,2020-04-28 14:33:15,3,"O app é ótimo, só tem uma coisa que me incomoda... Exemplo na série ""The walking dead"" Colocaram ela até a temporada 8, em outros app exemplo o ""Globoplay"" já tem a temporada 9, e isso é um saco! Está lá na Netflix em breve temporada 9 e nunca sai...",Positiva
20205,20206,2020-04-28 14:10:28,3,Muito bom mas tem que melhora,Positiva
20236,20237,2020-04-28 12:50:06,3,Quando eu atualizo tela fica preta tem como ver isso o que esta acontendo,Negativa
20259,20260,2020-04-28 11:36:44,3,Oaplicativo é bom mais demora muito pra lança os filmes é séries eu quero muito q lance logo o resto de Naruto shipudeen tem muitas pessoa querendo assistir Naruto shipudeen na Netflix maisnão tem todo. 😪,Positiva
20287,20288,2020-04-28 09:47:38,3,Oi eu queria saber se vai ter a segunda temporada do manicraft estore mod? Eu adorei essa série,Positiva
20292,20293,2020-04-28 08:56:17,3,Poderiam abranger mais os Clássicos...,Positiva
20313,20314,2020-04-28 05:47:28,3,"Já foi melhor,as séries estão sendo canceladas,demoram muito tempo tempo para entrar as próximas temporada, já indiquei hoje tenho dúvidas.",Positiva
20315,20316,2020-04-28 05:29:17,3,Em avaliação para melhorar as estrelas do app,Positiva
20332,20333,2020-04-28 04:29:47,3,"É ótima, mas a dublagem de português está comi português de Portugal!",Positiva
20339,20340,2020-04-28 04:21:15,3,Vou dar 3 estrelas pq vcs ai demora muito pra coloca séries ou posta mais série tem séries que eu já assistir todas na última temporada no termina todas igual a série Ponto cego 4 temporada acaba no episódio 22 logo na parte boa da série rpz de logo providenciar de lança a 5 temporada.,Positiva
20340,20341,2020-04-28 04:18:48,3,Amo muito o app. Mas há algumas séries q não estão completas no app enquanto em toros lugares já estão super completas faz tempo. (Como por exemplo icarly),Positiva
20342,20343,2020-04-28 04:18:11,3,"Eu gostaria muito que vocês ajeitassem a Netflix, porque a minha esta travando nas Séries, so consigo ouvir o audio.",Negativa
20360,20361,2020-04-28 03:45:26,3,Como que eu faço pra compartilha telas sem te que da minha senha?,Negativa
20364,20365,2020-04-28 03:43:12,3,Ótimo ate de mais,Positiva
20371,20372,2020-04-28 03:30:42,3,"A Netflix é um ótimo aplicativo tanto na questão da qualidade das séries e filmes, contém muitos e isso é de suma importância. Agora contém poucos filmes cristãos e séries; e deveria ter a mesma quantidade dos filmes de ficção, de romance e etc. Assim com certeza eu daria 5 estrelas!😉",Positiva
20400,20401,2020-04-28 02:36:39,3,Problemas frequente na conexão resolvam,Negativa
20401,20402,2020-04-28 02:35:47,3,so e pago,Negativa
20442,20443,2020-04-28 01:45:40,3,Traz Jojo pro catálogo aí Netflix kkkkkk,Positiva
20456,20457,2020-04-28 01:25:51,3,"pra ser honesto, a pior coisa que fazem é esconder oq fazem nas atualizações, tira conpletamente a mínima transparência que podiam ter, falando pra deixar tudo com eles.",Negativa
20463,20464,2020-04-28 01:13:35,3,"O app e ótimo,mas os filmes populares que são adicionados e de 2016 e 2017, então vc tem que esperar alguns anos para adicionarem filmes um pouco mais recente,outra coisa que não gostei e que as séries que gosto não lançou novas temporadas tipo daybreack,os sete pecados capitais e etc.",Positiva
20464,20465,2020-04-28 01:13:31,3,"O app é bom mas tem coisas desnecessárias, tipo a mensagem que aparece perguntando se tem alguém assistindo 🤦🏿‍♂️Ela atrapalha e ñ consigo tirar da tela nem apertando o play do celular, tenho que sair do aplicativo e retornar. Outra coisa o número de telas. Podia ter a opção de 3 telas e não pular de 2 pra 4",Negativa
20582,20583,2020-04-27 22:49:10,3,Seria ótimo se vcs acrescentasem no app controle de acesso em outros dispositivos de uma mesma conta,Negativa
20586,20587,2020-04-27 22:38:53,3,Netflix so coloca filme antigo e que não é em português,Positiva
20587,20588,2020-04-27 22:37:08,3,Não estou conseguindo visualizar meus downloads.,Negativa
20617,20618,2020-04-27 21:49:22,3,Legal uma pena q demora muito pra atualizar Mais é bom,Positiva
20622,20623,2020-04-27 21:46:55,3,"Gosto mt do App,as vezes tenho problema em colocar o áudio em português,fiquei bravo por que tiraram a série GRIMM,quando eu terminava a série começava Dnvo NETFLIX COLOCA GRIMM DNVO",Positiva
20642,20643,2020-04-27 21:16:22,3,Ainda falta filme e nem sempre acha o que quer,Positiva
20645,20646,2020-04-27 21:12:54,3,Deveria ser de graça,Positiva
20660,20661,2020-04-27 20:49:37,3,Queria ajuda pois o meu aplicativo não está abrindo nem mesmo na TV. Não sei o porquê! me ajudem.,Negativa
20698,20699,2020-04-27 19:38:48,3,Olá Netflix gostaria de informar que algumas séries estão com imagem borradas e o áudio estranho espero que consertem esse erro de,Negativa
20708,20709,2020-04-27 19:08:52,3,"Muito bom sem queixa,mas poderia colocar filmes mais atuais,o sétimo filho seria bom!",Positiva
20728,20729,2020-04-27 18:28:59,3,"O app atualmente está com alguns erros! Mesmo atualizando a versão... As séries/ filmes não estão aparecendo no ""continuar assistindo"". E nem está aparecendo a opção de remover também. Espero que resolvam isso!",Negativa
20729,20730,2020-04-27 18:25:43,3,Tem que lançar logo os episódios do Pokémon Sol e Lua,Positiva
20732,20733,2020-04-27 18:22:28,3,Não consigo mudar o idioma Por favor me ajudem isso e horrível,Negativa
20746,20747,2020-04-27 17:57:01,3,"Funcionava perfeitamente... Do nada começou aparecer tudo inglês, mexe na configuração e não resolve nada...",Negativa
20757,20758,2020-04-27 17:42:05,3,So vou da 5 estralas quando tever a segunda temporada de one punch man .,Positiva
20780,20781,2020-04-27 17:06:43,3,"Muitas series e poucos filmes. As séries são atrasadas, tem umas muito atrasadas 2T/3T, algumas faltam temporadas... DECEPÇÃO. Está travando direto o app aparece mensagens de erros, toda hora da um erro diferente. Minha internet é de 10mb e outra que costumo usar 100mb meu celular é atual Android 9.0 pie.",Negativa
20812,20813,2020-04-27 16:19:25,3,"Depois dessa nova atualização pra passar um episódio é horrível, não tem mais a opção assistir o próximo, ficou muito ruim",Negativa
20891,20892,2020-04-27 13:39:34,3,"Eu gosto muito desse app , mas por um motivo importante eu tive que desinstalar , e agora eu não estou conseguindo instalar . Vai até o 70 e depois volta pro 0 , e eu não sei o que fazer de aplicativo eu só tenho o zap .",Negativa
20913,20914,2020-04-27 12:19:48,3,S s s,Positiva
20932,20933,2020-04-27 11:27:41,3,Ótimo! !!,Positiva
20937,20938,2020-04-27 10:46:27,3,"Aplicativo muito bom mas no último mês estou tendo problemas em assistir meus downloads volta e meia o vídeo fecha e apresenta erro 5.7 ou 2.119 antes não fazia isso, trabalho embarcado e nao tenho internet boa a bordo entao os downloads eram bons passa tempo, agora nao sei se com as atualizações o App está precisando de internet melhor e com isso vem apresentando vários erros no meu S10, mas já uso ele a mais de 2 anos ótimo App, só estou tento problemas no último mês, espero que melhore .",Negativa
20961,20962,2020-04-27 07:37:10,3,Nao da para desinstalar do android?,Negativa
20990,20991,2020-04-27 05:06:49,3,"Neflix por favor não tira o filme o besouro verde porquê eu sei que você vai tirar esse filme , e se tirar coloca no mês seguinte eu ia ficar feliz e ia dar mais estrelas na avaliação.",Positiva
21001,21002,2020-04-27 04:32:42,3,"Bom gosto dos filme e séries que tem mais o que eu não gosto e que não tem as séries the vampire diaries, the originals e legacies gostaria que vocês adicionassem essas 3 séries para eu e outras pessoa verem",Positiva
21030,21031,2020-04-27 02:56:23,3,"Ocupa muito espaço no celular, ocupou 6g no meu cll (obs:meu cll é Motorola g5s plus)",Negativa
21038,21039,2020-04-27 02:45:01,3,"O aplicativo tirou a modo de acelerar a reprodução, eu assitia todos só filmes com essa ferramenta, vão colocar de novo?",Negativa
21053,21054,2020-04-27 02:22:13,3,"Poderia dar 5 estrelas,mas estou querendo maratonar Harry Potter com meu namorado..Vocês do Netflix poderiam renovar o contrato com a saga Harry Potter. Queremos Harry Potter nessa quarentena. #queremosHarryPotter #sagacompleta",Positiva
21077,21078,2020-04-27 01:34:53,3,O aplicativo é ótimo mas está Dando um bug e não dá para assistir nada sem contar que estava assistindo a once upon a time na primeira temporada e vocês tiraram a primeira e a segunda,Positiva
21078,21079,2020-04-27 01:33:40,3,Vcs deveriam voltar o.co triple dos pais pela classificação indicativa e não pelo perfil.,Positiva
21100,21101,2020-04-27 00:51:21,3,Esperava muito mais desse app sério,Positiva
21146,21147,2020-04-26 23:44:54,3,É muito bom mais eu queria que pras crianças fose gratuito pq elas não tem dinheiro,Positiva
21159,21160,2020-04-26 23:28:32,3,Olha baixei o apk e ele estava aberto tipo não tinha q fazer cadastro mais.tinha uns avatares e o.email era de uma tal.vanessinha aí tipo eu desconectei não sei o q foi isso alguém pode dizer o q é isso ?,Negativa
21177,21178,2020-04-26 22:58:43,3,legalzinho ate,Positiva
21210,21211,2020-04-26 21:59:04,3,App bom mais a series porqueiras devia trazer series melhor e novas temporadas the originais tem monte de temporadas novos e vez de colocar fizeram foi tirar a serie uma serie otima,Positiva
21279,21280,2020-04-26 19:48:52,3,A tela escurece do nada quando está assistindo.,Negativa
21281,21282,2020-04-26 19:45:13,3,"O app e muito bom mais não tô conseguindo entrar na minha conta, alguém me ajuda por favor 😥",Negativa
21319,21320,2020-04-26 18:38:27,3,"Já foi bom,, hoje em dia, tem muito filme ruim e filme em língua estrangeira sem opção de português, gostaria que melhorasse nisso ai",Negativa
21322,21323,2020-04-26 18:33:06,3,O app e ótimo mais mais tiram filmes muito bom Eu era mais a Netflix lança todos os filmes da barbi ainda mas nessa quarentena 👌💗,Positiva
21355,21356,2020-04-26 17:31:29,3,"Bom o App em se é ótimo! So que eu estava assistindo The Walking Dead e quando vi, não tinha mas a 9° e a 10° temporada. Olhem isso por favor, porque nao é so nessa série, vi que tem outras series que tem a 3° e 4° temporada, mas não tem a 1° e a 2°",Positiva
21370,21371,2020-04-26 17:05:47,3,"O App não quer abrir na TV estava dando erro, tentei desinstalar e instalar e agora simplesmente sumiu do guia de pesquisas porém pelo celular eu encontrar hoje! Mas n consigo se quer abrir",Negativa
21416,21417,2020-04-26 15:52:45,3,Depois da última atualização esta travando muito,Negativa
21429,21430,2020-04-26 15:38:43,3,"Dar dando um erro , não foi possível acessar a Netflix , erro -114",Negativa
21480,21481,2020-04-26 13:49:51,3,"Porque não aparece a imagem na reprodução no meu smartphone, apenas escutamos o áudio?",Negativa
21488,21489,2020-04-26 13:40:03,3,demora para instalar e carregar o app não gostei,Negativa
21504,21505,2020-04-26 13:16:39,3,O app é em inglês?,Negativa
21545,21546,2020-04-26 10:16:37,3,Minha senha e e-mail certo e não consigo acessar 😡😡😡,Negativa
21565,21566,2020-04-26 07:30:01,3,"Na minha opinião, apesar de ser cliente da netflix recentemente, acho um pouco alto o valor mensal. Mas, as minhas filhas gostam de algumas séries. Eu sou uma pessoa de filmes, portanto, conheço a maioria dos filmes que netflix tem disponível, que tiveram sucesso nos cinemas (não são muitos assim). Daí ter a minha opinião, ser um pouco alto o valor.",Positiva
